{"strategy_type": "sma_crossover", "params": {"fast_ma": 10, "slow_ma": 30, "strategy_type": "sma_crossover", "timeframe": "1h"}, "timerange": "20210101-", "regime": "", "sentiment_score": 0.0, "sharpe": 1.2, "win_rate": 0.6, "max_drawdown": -0.03, "total_trades": 50, "profit_factor": 1.0, "walk_forward_passed": false, "monte_carlo_dd_95pct": 0.0, "synthetic_sanity_passed": false, "verdict": "kept", "iteration": 1}
{"strategy_type": "sma_crossover", "params": {"fast_ma": 10, "strategy_type": "sma_crossover", "timeframe": "1h"}, "timerange": "20210101-", "regime": "", "sentiment_score": 0.0, "sharpe": 1.2, "win_rate": 0.6, "max_drawdown": -0.03, "total_trades": 50, "profit_factor": 1.0, "walk_forward_passed": false, "monte_carlo_dd_95pct": 0.0, "synthetic_sanity_passed": false, "verdict": "kept", "iteration": 1}
{"strategy_type": "sma_crossover", "params": {"fast_ma": 10, "slow_ma": 30, "strategy_type": "sma_crossover", "timeframe": "1h"}, "timerange": "20210101-", "regime": "", "sentiment_score": 0.0, "sharpe": 1.2, "win_rate": 0.6, "max_drawdown": -0.03, "total_trades": 50, "profit_factor": 1.0, "walk_forward_passed": false, "monte_carlo_dd_95pct": 0.0, "synthetic_sanity_passed": false, "verdict": "kept", "iteration": 1}
{"strategy_type": "sma_crossover", "params": {"fast_ma": 10, "strategy_type": "sma_crossover", "timeframe": "1h"}, "timerange": "20210101-", "regime": "", "sentiment_score": 0.0, "sharpe": 1.2, "win_rate": 0.6, "max_drawdown": -0.03, "total_trades": 50, "profit_factor": 1.0, "walk_forward_passed": false, "monte_carlo_dd_95pct": 0.0, "synthetic_sanity_passed": false, "verdict": "kept", "iteration": 1}
