{"strategy_type": "combined_sma_rsi", "params": {"fast_ma": 10, "slow_ma": 30, "rsi_period": 14, "rsi_threshold": 50, "stoploss": -0.05, "timeframe": "1h", "_strategy_id": "3bfae008"}, "timerange": "20231001-20231231", "regime": "", "sentiment_score": 0.0, "sharpe": 0.5693780031575675, "win_rate": 0.5662650602409639, "max_drawdown": 0.001209948652139587, "total_trades": 83, "profit_factor": 1.0, "walk_forward_passed": false, "monte_carlo_dd_95pct": 0.0, "synthetic_sanity_passed": false, "verdict": "discarded", "iteration": 39}
{"strategy_type": "rsi_oversold", "params": {"stoploss": -0.05, "rsi_period": 14, "rsi_buy_threshold": 30, "rsi_sell_threshold": 70, "timeframe": "1h", "_strategy_id": "bdae6396"}, "timerange": "20231001-20231231", "regime": "", "sentiment_score": 0.0, "sharpe": 1.335728099993389, "win_rate": 0.8571428571428571, "max_drawdown": 0.0008138982480000777, "total_trades": 28, "profit_factor": 1.0, "walk_forward_passed": false, "monte_carlo_dd_95pct": 0.0, "synthetic_sanity_passed": false, "verdict": "kept", "iteration": 40}
{"strategy_type": "multi_timeframe", "params": {"timeframe": "1h"}, "timerange": "20230101-20231231", "regime": "", "sentiment_score": 0.0, "sharpe": -0.8080813219289936, "win_rate": 0.4375, "max_drawdown": 0.002978963599169155, "total_trades": 48, "profit_factor": 1.0, "walk_forward_passed": false, "monte_carlo_dd_95pct": 0.0, "synthetic_sanity_passed": false, "verdict": "discarded", "iteration": 7}
{"strategy_type": "multi_timeframe", "params": {"fast_ma": 10, "slow_ma": 50, "adx_threshold": 25, "rsi_oversold": 25, "rsi_overbought": 75, "stop_loss_atr": 1.5, "take_profit_atr": 2.0, "timeframe": "1h"}, "timerange": "20230101-20231231", "regime": "", "sentiment_score": 0.0, "sharpe": -0.8080813219289936, "win_rate": 0.4375, "max_drawdown": 0.002978963599169155, "total_trades": 48, "profit_factor": 1.0, "walk_forward_passed": false, "monte_carlo_dd_95pct": 0.0, "synthetic_sanity_passed": false, "verdict": "discarded", "iteration": 8}
{"strategy_type": "multi_timeframe", "params": {"timeframe": "1h"}, "timerange": "20230101-20231231", "regime": "", "sentiment_score": 0.0, "sharpe": -0.8080813219289936, "win_rate": 0.4375, "max_drawdown": 0.002978963599169155, "total_trades": 48, "profit_factor": 1.0, "walk_forward_passed": false, "monte_carlo_dd_95pct": 0.0, "synthetic_sanity_passed": false, "verdict": "discarded", "iteration": 9}
{"strategy_type": "multi_timeframe", "params": {"fast_ma": 10, "slow_ma": 50, "adx_threshold": 25, "rsi_oversold": 30, "rsi_overbought": 70, "stop_loss_atr": 1.5, "take_profit_atr": 2.0, "stoploss": -0.05, "timeframe": "1h"}, "timerange": "20230101-20231231", "regime": "", "sentiment_score": 0.0, "sharpe": -0.8080813219289936, "win_rate": 0.4375, "max_drawdown": 0.002978963599169155, "total_trades": 48, "profit_factor": 1.0, "walk_forward_passed": false, "monte_carlo_dd_95pct": 0.0, "synthetic_sanity_passed": false, "verdict": "discarded", "iteration": 10}
{"strategy_type": "multi_timeframe", "params": {"timeframe": "1h"}, "timerange": "20230101-20231231", "regime": "", "sentiment_score": 0.0, "sharpe": -0.8080813219289936, "win_rate": 0.4375, "max_drawdown": 0.002978963599169155, "total_trades": 48, "profit_factor": 1.0, "walk_forward_passed": false, "monte_carlo_dd_95pct": 0.0, "synthetic_sanity_passed": false, "verdict": "discarded", "iteration": 11}
{"strategy_type": "multi_timeframe", "params": {"fast_ma": 10, "slow_ma": 50, "adx_threshold": 25, "rsi_oversold": 25, "rsi_overbought": 50, "stop_loss_atr": 1.0, "take_profit_atr": 1.5, "stoploss": -0.03, "use_200sma_trend_filter": true, "entry_rsi_threshold": 25, "exit_rsi_threshold": 50, "risk_reward_ratio": 1.5, "timeframe": "1h"}, "timerange": "20230101-20231001", "regime": "", "sentiment_score": 0.0, "sharpe": -1.1076454163347118, "win_rate": 0.35294117647058826, "max_drawdown": 0.0025294010718554943, "total_trades": 34, "profit_factor": 1.0, "walk_forward_passed": false, "monte_carlo_dd_95pct": 0.0, "synthetic_sanity_passed": false, "verdict": "discarded", "iteration": 12}
{"strategy_type": "multi_timeframe", "params": {"timeframe": "1h"}, "timerange": "20230101-20231001", "regime": "", "sentiment_score": 0.0, "sharpe": -1.1155978905813648, "win_rate": 0.35294117647058826, "max_drawdown": 0.002978963599169155, "total_trades": 34, "profit_factor": 1.0, "walk_forward_passed": false, "monte_carlo_dd_95pct": 0.0, "synthetic_sanity_passed": false, "verdict": "discarded", "iteration": 13}
{"strategy_type": "multi_timeframe", "params": {"fast_ma": 10, "slow_ma": 50, "higher_tf_ma": 200, "adx_threshold": 25, "timeframe": "1h"}, "timerange": "20230101-20231231", "regime": "", "sentiment_score": 0.0, "sharpe": -0.8080813219289936, "win_rate": 0.4375, "max_drawdown": 0.002978963599169155, "total_trades": 48, "profit_factor": 1.0, "walk_forward_passed": false, "monte_carlo_dd_95pct": 0.0, "synthetic_sanity_passed": false, "verdict": "discarded", "iteration": 14}
{"strategy_type": "multi_timeframe", "params": {"timeframe": "1h"}, "timerange": "20230101-20231231", "regime": "", "sentiment_score": 0.0, "sharpe": -0.8080813219289936, "win_rate": 0.4375, "max_drawdown": 0.002978963599169155, "total_trades": 48, "profit_factor": 1.0, "walk_forward_passed": false, "monte_carlo_dd_95pct": 0.0, "synthetic_sanity_passed": false, "verdict": "discarded", "iteration": 15}
{"strategy_type": "multi_timeframe", "params": {"fast_ma": 20, "slow_ma": 50, "adx_period": 14, "adx_threshold": 25, "timeframe": "1h"}, "timerange": "20230101-20231231", "regime": "", "sentiment_score": 0.0, "sharpe": -0.8080813219289936, "win_rate": 0.4375, "max_drawdown": 0.002978963599169155, "total_trades": 48, "profit_factor": 1.0, "walk_forward_passed": false, "monte_carlo_dd_95pct": 0.0, "synthetic_sanity_passed": false, "verdict": "discarded", "iteration": 16}
{"strategy_type": "multi_timeframe", "params": {"timeframe": "1h"}, "timerange": "20230101-20231231", "regime": "", "sentiment_score": 0.0, "sharpe": -0.8080813219289936, "win_rate": 0.4375, "max_drawdown": 0.002978963599169155, "total_trades": 48, "profit_factor": 1.0, "walk_forward_passed": false, "monte_carlo_dd_95pct": 0.0, "synthetic_sanity_passed": false, "verdict": "discarded", "iteration": 17}
{"strategy_type": "multi_timeframe", "params": {"fast_ma": 20, "slow_ma": 50, "regime": "strong_downtrend", "timeframe": "1h"}, "timerange": "20230101-20231231", "regime": "", "sentiment_score": 0.0, "sharpe": -0.8080813219289936, "win_rate": 0.4375, "max_drawdown": 0.002978963599169155, "total_trades": 48, "profit_factor": 1.0, "walk_forward_passed": false, "monte_carlo_dd_95pct": 0.0, "synthetic_sanity_passed": false, "verdict": "discarded", "iteration": 18}
{"strategy_type": "multi_timeframe", "params": {"timeframe": "1h"}, "timerange": "20230101-20231231", "regime": "", "sentiment_score": 0.0, "sharpe": -0.8080813219289936, "win_rate": 0.4375, "max_drawdown": 0.002978963599169155, "total_trades": 48, "profit_factor": 1.0, "walk_forward_passed": false, "monte_carlo_dd_95pct": 0.0, "synthetic_sanity_passed": false, "verdict": "discarded", "iteration": 19}
{"strategy_type": "multi_timeframe", "params": {"fast_ma": 10, "slow_ma": 50, "adx_threshold": 25, "rsi_oversold_threshold": 25, "use_rsi_filter": true, "use_bb_confirmation": true, "bb_period": 20, "bb_std": 2.0, "timeframe": "1h"}, "timerange": "20230101-20231231", "regime": "", "sentiment_score": 0.0, "sharpe": -0.8080813219289936, "win_rate": 0.4375, "max_drawdown": 0.002978963599169155, "total_trades": 48, "profit_factor": 1.0, "walk_forward_passed": false, "monte_carlo_dd_95pct": 0.0, "synthetic_sanity_passed": false, "verdict": "discarded", "iteration": 20}
{"strategy_type": "multi_timeframe", "params": {"timeframe": "1h"}, "timerange": "20230101-20231231", "regime": "", "sentiment_score": 0.0, "sharpe": -0.8080813219289936, "win_rate": 0.4375, "max_drawdown": 0.002978963599169155, "total_trades": 48, "profit_factor": 1.0, "walk_forward_passed": false, "monte_carlo_dd_95pct": 0.0, "synthetic_sanity_passed": false, "verdict": "discarded", "iteration": 21}
{"strategy_type": "multi_timeframe", "params": {"fast_ma": 5, "slow_ma": 50, "adx_threshold": 25, "rsi_oversold_threshold": 20, "use_rsi_filter": true, "use_bb_confirmation": true, "bb_period": 20, "bb_std": 2.0, "regime": "strong_downtrend", "use_ema_slope_filter": true, "ema_slope_period": 50, "exit_at_ema": true, "timeframe": "1h"}, "timerange": "20230101-20231231", "regime": "", "sentiment_score": 0.0, "sharpe": -0.8080813219289936, "win_rate": 0.4375, "max_drawdown": 0.002978963599169155, "total_trades": 48, "profit_factor": 1.0, "walk_forward_passed": false, "monte_carlo_dd_95pct": 0.0, "synthetic_sanity_passed": false, "verdict": "discarded", "iteration": 22}
{"strategy_type": "multi_timeframe", "params": {"timeframe": "1h"}, "timerange": "20230101-20231231", "regime": "", "sentiment_score": 0.0, "sharpe": -0.8080813219289936, "win_rate": 0.4375, "max_drawdown": 0.002978963599169155, "total_trades": 48, "profit_factor": 1.0, "walk_forward_passed": false, "monte_carlo_dd_95pct": 0.0, "synthetic_sanity_passed": false, "verdict": "discarded", "iteration": 23}
{"strategy_type": "multi_timeframe", "params": {"fast_ma": 5, "slow_ma": 50, "adx_threshold": 25, "rsi_oversold_threshold": 10, "use_rsi_filter": true, "rsi_period": 2, "use_bb_confirmation": true, "bb_period": 20, "bb_std": 2.0, "regime": "strong_downtrend", "use_ema_slope_filter": true, "ema_slope_period": 50, "exit_at_ema": true, "exit_ema_period": 20, "use_atr_stop": true, "atr_period": 14, "atr_multiplier": 1.5, "use_time_stop": true, "time_stop_bars": 30, "entry_logic": "rsi_bb_overshoot", "description": "Multi-timeframe mean-reversion for strong downtrend: Enters on 5-min RSI(2) < 10 AND price below BB lower band (20,2). Confirms with 50-period EMA slope downtrend. Exits when price crosses above 20-period EMA. Hard stop at 1.5x ATR(14). Time stop at 30 bars. ADX > 25 confirms trend strength.", "stoploss": -0.03, "timeframe": "1h"}, "timerange": "20230101-20231231", "regime": "", "sentiment_score": 0.0, "sharpe": -0.7635195090617383, "win_rate": 0.4375, "max_drawdown": 0.0025294010718554943, "total_trades": 48, "profit_factor": 1.0, "walk_forward_passed": false, "monte_carlo_dd_95pct": 0.0, "synthetic_sanity_passed": false, "verdict": "discarded", "iteration": 24}
{"strategy_type": "multi_timeframe", "params": {"timeframe": "1h"}, "timerange": "20230101-20231231", "regime": "", "sentiment_score": 0.0, "sharpe": -0.8080813219289936, "win_rate": 0.4375, "max_drawdown": 0.002978963599169155, "total_trades": 48, "profit_factor": 1.0, "walk_forward_passed": false, "monte_carlo_dd_95pct": 0.0, "synthetic_sanity_passed": false, "verdict": "discarded", "iteration": 25}
{"strategy_type": "multi_timeframe", "params": {"fast_ma": 10, "slow_ma": 100, "timeframe": "1h"}, "timerange": "20230101-20231231", "regime": "", "sentiment_score": 0.0, "sharpe": -0.8080813219289936, "win_rate": 0.4375, "max_drawdown": 0.002978963599169155, "total_trades": 48, "profit_factor": 1.0, "walk_forward_passed": false, "monte_carlo_dd_95pct": 0.0, "synthetic_sanity_passed": false, "verdict": "discarded", "iteration": 26}
{"strategy_type": "multi_timeframe", "params": {"timeframe": "1h"}, "timerange": "20230101-20231231", "regime": "", "sentiment_score": 0.0, "sharpe": -0.8080813219289936, "win_rate": 0.4375, "max_drawdown": 0.002978963599169155, "total_trades": 48, "profit_factor": 1.0, "walk_forward_passed": false, "monte_carlo_dd_95pct": 0.0, "synthetic_sanity_passed": false, "verdict": "discarded", "iteration": 27}
{"strategy_type": "multi_timeframe", "params": {"fast_ma": 20, "slow_ma": 50, "adx_threshold": 25, "rsi_period": 14, "rsi_oversold": 30, "rsi_overbought": 70, "stop_loss_atr_mult": 1.5, "trailing_stop": true, "timeframe": "1h"}, "timerange": "20230101-20231231", "regime": "", "sentiment_score": 0.0, "sharpe": -0.7996567423301504, "win_rate": 0.4375, "max_drawdown": 0.0028454293570911757, "total_trades": 48, "profit_factor": 1.0, "walk_forward_passed": false, "monte_carlo_dd_95pct": 0.0, "synthetic_sanity_passed": false, "verdict": "discarded", "iteration": 28}
{"strategy_type": "multi_timeframe", "params": {"timeframe": "1h"}, "timerange": "20230101-20231231", "regime": "", "sentiment_score": 0.0, "sharpe": -0.8080813219289936, "win_rate": 0.4375, "max_drawdown": 0.002978963599169155, "total_trades": 48, "profit_factor": 1.0, "walk_forward_passed": false, "monte_carlo_dd_95pct": 0.0, "synthetic_sanity_passed": false, "verdict": "discarded", "iteration": 29}
{"strategy_type": "multi_timeframe", "params": {"fast_ma": 10, "slow_ma": 30, "adx_threshold": 30, "rsi_period": 14, "rsi_oversold": 25, "rsi_overbought": 75, "stop_loss_atr_mult": 1.2, "trailing_stop": true, "timeframe": "1h"}, "timerange": "20220101-20231231", "regime": "", "sentiment_score": 0.0, "sharpe": -0.2508024133848824, "win_rate": 0.5444444444444444, "max_drawdown": 0.002842463000277049, "total_trades": 90, "profit_factor": 1.0, "walk_forward_passed": false, "monte_carlo_dd_95pct": 0.0, "synthetic_sanity_passed": false, "verdict": "discarded", "iteration": 30}
{"strategy_type": "multi_timeframe", "params": {"fast_ma": 8, "slow_ma": 50, "adx_threshold": 30, "rsi_oversold": 20, "use_rsi_filter": true, "stoploss": -0.03, "take_profit": 0.02, "timeframe": "1h"}, "timerange": "20220101-20231231", "regime": "", "sentiment_score": 0.0, "sharpe": -0.19458149019479948, "win_rate": 0.5444444444444444, "max_drawdown": 0.002526543487987752, "total_trades": 90, "profit_factor": 1.0, "walk_forward_passed": false, "monte_carlo_dd_95pct": 0.0, "synthetic_sanity_passed": false, "verdict": "discarded", "iteration": 31}
{"strategy_type": "multi_timeframe", "params": {"timeframe": "1h"}, "timerange": "20220101-20231231", "regime": "", "sentiment_score": 0.0, "sharpe": -0.2663951624776854, "win_rate": 0.5444444444444444, "max_drawdown": 0.00297585803306209, "total_trades": 90, "profit_factor": 1.0, "walk_forward_passed": false, "monte_carlo_dd_95pct": 0.0, "synthetic_sanity_passed": false, "verdict": "discarded", "iteration": 32}
{"strategy_type": "multi_timeframe", "params": {"fast_ma": 10, "slow_ma": 50, "adx_period": 14, "adx_threshold": 30, "rsi_period": 14, "rsi_buy_threshold": 25, "rsi_sell_threshold": 65, "use_rsi_filter": true, "use_adx_filter": true, "stoploss": -0.03, "timeframe": "1h"}, "timerange": "20220101-20231231", "regime": "", "sentiment_score": 0.0, "sharpe": -0.19458149019479948, "win_rate": 0.5444444444444444, "max_drawdown": 0.002526543487987752, "total_trades": 90, "profit_factor": 1.0, "walk_forward_passed": false, "monte_carlo_dd_95pct": 0.0, "synthetic_sanity_passed": false, "verdict": "discarded", "iteration": 33}
{"strategy_type": "multi_timeframe", "params": {"timeframe": "1h"}, "timerange": "20220101-20231231", "regime": "", "sentiment_score": 0.0, "sharpe": -0.2663951624776854, "win_rate": 0.5444444444444444, "max_drawdown": 0.00297585803306209, "total_trades": 90, "profit_factor": 1.0, "walk_forward_passed": false, "monte_carlo_dd_95pct": 0.0, "synthetic_sanity_passed": false, "verdict": "discarded", "iteration": 34}
{"strategy_type": "multi_timeframe", "params": {"fast_ma": 10, "slow_ma": 50, "adx_period": 14, "adx_threshold": 25, "rsi_period": 14, "rsi_buy_threshold": 20, "rsi_sell_threshold": 60, "use_rsi_filter": true, "use_adx_filter": true, "stoploss": -0.02, "take_profit": 0.04, "timeframe": "1h"}, "timerange": "20220101-20231231", "regime": "", "sentiment_score": 0.0, "sharpe": -0.11136513900976394, "win_rate": 0.5444444444444444, "max_drawdown": 0.002220701090322003, "total_trades": 90, "profit_factor": 1.0, "walk_forward_passed": false, "monte_carlo_dd_95pct": 0.0, "synthetic_sanity_passed": false, "verdict": "discarded", "iteration": 35}
{"strategy_type": "multi_timeframe", "params": {"timeframe": "1h"}, "timerange": "20220101-20231231", "regime": "", "sentiment_score": 0.0, "sharpe": -0.2663951624776854, "win_rate": 0.5444444444444444, "max_drawdown": 0.00297585803306209, "total_trades": 90, "profit_factor": 1.0, "walk_forward_passed": false, "monte_carlo_dd_95pct": 0.0, "synthetic_sanity_passed": false, "verdict": "discarded", "iteration": 36}
{"strategy_type": "multi_timeframe", "params": {"fast_ma": 5, "slow_ma": 20, "adx_threshold": 30, "rsi_oversold": 20, "volume_factor": 1.5, "atr_multiplier": 2.0, "timeframe": "1h"}, "timerange": "20220101-20231231", "regime": "", "sentiment_score": 0.0, "sharpe": -0.2663951624776854, "win_rate": 0.5444444444444444, "max_drawdown": 0.00297585803306209, "total_trades": 90, "profit_factor": 1.0, "walk_forward_passed": false, "monte_carlo_dd_95pct": 0.0, "synthetic_sanity_passed": false, "verdict": "discarded", "iteration": 37}
{"strategy_type": "multi_timeframe", "params": {"timeframe": "1h"}, "timerange": "20220101-20231231", "regime": "", "sentiment_score": 0.0, "sharpe": -0.2663951624776854, "win_rate": 0.5444444444444444, "max_drawdown": 0.00297585803306209, "total_trades": 90, "profit_factor": 1.0, "walk_forward_passed": false, "monte_carlo_dd_95pct": 0.0, "synthetic_sanity_passed": false, "verdict": "discarded", "iteration": 38}
{"strategy_type": "multi_timeframe", "params": {"fast_ma": 20, "slow_ma": 200, "rsi_period": 14, "rsi_buy_threshold": 30, "adx_threshold": 25, "stoploss": -0.05, "timeframe": "1h"}, "timerange": "20220101-20231231", "regime": "", "sentiment_score": 0.0, "sharpe": -0.2663951624776854, "win_rate": 0.5444444444444444, "max_drawdown": 0.00297585803306209, "total_trades": 90, "profit_factor": 1.0, "walk_forward_passed": false, "monte_carlo_dd_95pct": 0.0, "synthetic_sanity_passed": false, "verdict": "discarded", "iteration": 39}
{"strategy_type": "multi_timeframe", "params": {"timeframe": "1h"}, "timerange": "20220101-20231231", "regime": "", "sentiment_score": 0.0, "sharpe": -0.2663951624776854, "win_rate": 0.5444444444444444, "max_drawdown": 0.00297585803306209, "total_trades": 90, "profit_factor": 1.0, "walk_forward_passed": false, "monte_carlo_dd_95pct": 0.0, "synthetic_sanity_passed": false, "verdict": "discarded", "iteration": 40}
{"strategy_type": "multi_timeframe", "params": {"fast_ma": 20, "slow_ma": 200, "rsi_period": 14, "rsi_buy_threshold": 30, "adx_threshold": 25, "stoploss": -0.05, "description": "Multi-timeframe mean reversion in strong downtrend. Uses 200-period SMA on higher timeframe to confirm bearish regime, then 20/50 SMA crossover on lower timeframe for entry timing with RSI < 30 oversold filter. ADX > 25 ensures trend strength.", "timeframe": "1h"}, "timerange": "20230101-20231231", "regime": "", "sentiment_score": 0.0, "sharpe": -0.8080813219289936, "win_rate": 0.4375, "max_drawdown": 0.002978963599169155, "total_trades": 48, "profit_factor": 1.0, "walk_forward_passed": false, "monte_carlo_dd_95pct": 0.0, "synthetic_sanity_passed": false, "verdict": "discarded", "iteration": 41}
{"strategy_type": "multi_timeframe", "params": {"timeframe": "1h"}, "timerange": "20230101-20231231", "regime": "", "sentiment_score": 0.0, "sharpe": -0.8080813219289936, "win_rate": 0.4375, "max_drawdown": 0.002978963599169155, "total_trades": 48, "profit_factor": 1.0, "walk_forward_passed": false, "monte_carlo_dd_95pct": 0.0, "synthetic_sanity_passed": false, "verdict": "discarded", "iteration": 42}
{"strategy_type": "multi_timeframe", "params": {"fast_ma": 15, "slow_ma": 50, "adx_threshold": 30, "rsi_oversold_threshold": 25, "trailing_stop_pct": 1.0, "exit_bars": 2, "stoploss": -0.02, "timeframe": "1h"}, "timerange": "20230101-20231231", "regime": "", "sentiment_score": 0.0, "sharpe": -0.6977588851405517, "win_rate": 0.4375, "max_drawdown": 0.0022234283738945615, "total_trades": 48, "profit_factor": 1.0, "walk_forward_passed": false, "monte_carlo_dd_95pct": 0.0, "synthetic_sanity_passed": false, "verdict": "discarded", "iteration": 43}
{"strategy_type": "multi_timeframe", "params": {"timeframe": "1h"}, "timerange": "20230101-20231231", "regime": "", "sentiment_score": 0.0, "sharpe": -0.8080813219289936, "win_rate": 0.4375, "max_drawdown": 0.002978963599169155, "total_trades": 48, "profit_factor": 1.0, "walk_forward_passed": false, "monte_carlo_dd_95pct": 0.0, "synthetic_sanity_passed": false, "verdict": "discarded", "iteration": 44}
{"strategy_type": "multi_timeframe", "params": {"fast_ma": 10, "slow_ma": 50, "adx_threshold": 25, "rsi_oversold": 25, "take_profit_atr": 0.5, "stop_loss_atr": 0.3, "timeframe": "1h"}, "timerange": "20230101-20231231", "regime": "", "sentiment_score": 0.0, "sharpe": -0.8080813219289936, "win_rate": 0.4375, "max_drawdown": 0.002978963599169155, "total_trades": 48, "profit_factor": 1.0, "walk_forward_passed": false, "monte_carlo_dd_95pct": 0.0, "synthetic_sanity_passed": false, "verdict": "discarded", "iteration": 45}
{"strategy_type": "multi_timeframe", "params": {"timeframe": "1h"}, "timerange": "20230101-20231231", "regime": "", "sentiment_score": 0.0, "sharpe": -0.8080813219289936, "win_rate": 0.4375, "max_drawdown": 0.002978963599169155, "total_trades": 48, "profit_factor": 1.0, "walk_forward_passed": false, "monte_carlo_dd_95pct": 0.0, "synthetic_sanity_passed": false, "verdict": "discarded", "iteration": 46}
{"strategy_type": "multi_timeframe", "params": {"fast_ma": 10, "slow_ma": 100, "timeframe": "1h"}, "timerange": "20230101-20231231", "regime": "", "sentiment_score": 0.0, "sharpe": -0.8080813219289936, "win_rate": 0.4375, "max_drawdown": 0.002978963599169155, "total_trades": 48, "profit_factor": 1.0, "walk_forward_passed": false, "monte_carlo_dd_95pct": 0.0, "synthetic_sanity_passed": false, "verdict": "discarded", "iteration": 47}
