{"strategy_type": "multi_timeframe", "params": {"timeframe": "1h"}, "timerange": "20230101-20231231", "regime": "", "sentiment_score": 0.0, "sharpe": -0.8080813219289936, "win_rate": 0.4375, "max_drawdown": 0.002978963599169155, "total_trades": 48, "profit_factor": 1.0, "walk_forward_passed": false, "monte_carlo_dd_95pct": 0.0, "synthetic_sanity_passed": false, "verdict": "discarded", "iteration": 48}
{"strategy_type": "multi_timeframe", "params": {"fast_ma": 10, "slow_ma": 50, "adx_period": 14, "adx_threshold": 25, "timeframe": "1h"}, "timerange": "20230101-20231231", "regime": "", "sentiment_score": 0.0, "sharpe": -0.8080813219289936, "win_rate": 0.4375, "max_drawdown": 0.002978963599169155, "total_trades": 48, "profit_factor": 1.0, "walk_forward_passed": false, "monte_carlo_dd_95pct": 0.0, "synthetic_sanity_passed": false, "verdict": "discarded", "iteration": 49}
{"strategy_type": "sma_crossover", "params": {"fast_ma": 10, "slow_ma": 30, "strategy_type": "sma_crossover", "timeframe": "1h"}, "timerange": "20210101-", "regime": "", "sentiment_score": 0.0, "sharpe": 1.2, "win_rate": 0.6, "max_drawdown": -0.03, "total_trades": 50, "profit_factor": 1.0, "walk_forward_passed": false, "monte_carlo_dd_95pct": 0.0, "synthetic_sanity_passed": false, "verdict": "kept", "iteration": 1}
{"strategy_type": "sma_crossover", "params": {"fast_ma": 10, "strategy_type": "sma_crossover", "timeframe": "1h"}, "timerange": "20210101-", "regime": "", "sentiment_score": 0.0, "sharpe": 1.2, "win_rate": 0.6, "max_drawdown": -0.03, "total_trades": 50, "profit_factor": 1.0, "walk_forward_passed": false, "monte_carlo_dd_95pct": 0.0, "synthetic_sanity_passed": false, "verdict": "kept", "iteration": 1}
{"strategy_type": "sma_crossover", "params": {"fast_ma": 10, "slow_ma": 30, "strategy_type": "sma_crossover", "timeframe": "1h"}, "timerange": "20210101-", "regime": "", "sentiment_score": 0.0, "sharpe": 1.2, "win_rate": 0.6, "max_drawdown": -0.03, "total_trades": 50, "profit_factor": 1.0, "walk_forward_passed": false, "monte_carlo_dd_95pct": 0.0, "synthetic_sanity_passed": false, "verdict": "kept", "iteration": 1}
{"strategy_type": "sma_crossover", "params": {"fast_ma": 10, "strategy_type": "sma_crossover", "timeframe": "1h"}, "timerange": "20210101-", "regime": "", "sentiment_score": 0.0, "sharpe": 1.2, "win_rate": 0.6, "max_drawdown": -0.03, "total_trades": 50, "profit_factor": 1.0, "walk_forward_passed": false, "monte_carlo_dd_95pct": 0.0, "synthetic_sanity_passed": false, "verdict": "kept", "iteration": 1}
{"strategy_type": "sma_crossover", "params": {"fast_ma": 10, "slow_ma": 30, "strategy_type": "sma_crossover", "timeframe": "1h"}, "timerange": "20210101-", "regime": "", "sentiment_score": 0.0, "sharpe": 1.2, "win_rate": 0.6, "max_drawdown": -0.03, "total_trades": 50, "profit_factor": 1.0, "walk_forward_passed": false, "monte_carlo_dd_95pct": 0.0, "synthetic_sanity_passed": false, "verdict": "kept", "iteration": 1}
{"strategy_type": "sma_crossover", "params": {"fast_ma": 10, "strategy_type": "sma_crossover", "timeframe": "1h"}, "timerange": "20210101-", "regime": "", "sentiment_score": 0.0, "sharpe": 1.2, "win_rate": 0.6, "max_drawdown": -0.03, "total_trades": 50, "profit_factor": 1.0, "walk_forward_passed": false, "monte_carlo_dd_95pct": 0.0, "synthetic_sanity_passed": false, "verdict": "kept", "iteration": 1}
{"strategy_type": "sma_crossover", "params": {"fast_ma": 10, "slow_ma": 30, "strategy_type": "sma_crossover", "timeframe": "1h"}, "timerange": "20210101-", "regime": "", "sentiment_score": 0.0, "sharpe": 1.2, "win_rate": 0.6, "max_drawdown": -0.03, "total_trades": 50, "profit_factor": 1.0, "walk_forward_passed": false, "monte_carlo_dd_95pct": 0.0, "synthetic_sanity_passed": false, "verdict": "kept", "iteration": 1}
{"strategy_type": "sma_crossover", "params": {"fast_ma": 10, "strategy_type": "sma_crossover", "timeframe": "1h"}, "timerange": "20210101-", "regime": "", "sentiment_score": 0.0, "sharpe": 1.2, "win_rate": 0.6, "max_drawdown": -0.03, "total_trades": 50, "profit_factor": 1.0, "walk_forward_passed": false, "monte_carlo_dd_95pct": 0.0, "synthetic_sanity_passed": false, "verdict": "kept", "iteration": 1}
{"strategy_type": "sma_crossover", "params": {"fast_ma": 10, "slow_ma": 30, "strategy_type": "sma_crossover", "timeframe": "1h"}, "timerange": "20210101-", "regime": "", "sentiment_score": 0.0, "sharpe": 1.2, "win_rate": 0.6, "max_drawdown": -0.03, "total_trades": 50, "profit_factor": 1.0, "walk_forward_passed": false, "monte_carlo_dd_95pct": 0.0, "synthetic_sanity_passed": false, "verdict": "kept", "iteration": 1}
{"strategy_type": "sma_crossover", "params": {"fast_ma": 10, "strategy_type": "sma_crossover", "timeframe": "1h"}, "timerange": "20210101-", "regime": "", "sentiment_score": 0.0, "sharpe": 1.2, "win_rate": 0.6, "max_drawdown": -0.03, "total_trades": 50, "profit_factor": 1.0, "walk_forward_passed": false, "monte_carlo_dd_95pct": 0.0, "synthetic_sanity_passed": false, "verdict": "kept", "iteration": 1}
{"strategy_type": "sma_crossover", "params": {"fast_ma": 10, "slow_ma": 30, "strategy_type": "sma_crossover", "timeframe": "1h"}, "timerange": "20210101-", "regime": "", "sentiment_score": 0.0, "sharpe": 1.2, "win_rate": 0.6, "max_drawdown": -0.03, "total_trades": 50, "profit_factor": 1.0, "walk_forward_passed": false, "monte_carlo_dd_95pct": 0.0, "synthetic_sanity_passed": false, "verdict": "kept", "iteration": 1}
{"strategy_type": "sma_crossover", "params": {"fast_ma": 10, "strategy_type": "sma_crossover", "timeframe": "1h"}, "timerange": "20210101-", "regime": "", "sentiment_score": 0.0, "sharpe": 1.2, "win_rate": 0.6, "max_drawdown": -0.03, "total_trades": 50, "profit_factor": 1.0, "walk_forward_passed": false, "monte_carlo_dd_95pct": 0.0, "synthetic_sanity_passed": false, "verdict": "kept", "iteration": 1}
{"strategy_type": "sma_crossover", "params": {"fast_ma": 10, "slow_ma": 30, "strategy_type": "sma_crossover", "timeframe": "1h"}, "timerange": "20210101-", "regime": "", "sentiment_score": 0.0, "sharpe": 1.2, "win_rate": 0.6, "max_drawdown": -0.03, "total_trades": 50, "profit_factor": 1.0, "walk_forward_passed": false, "monte_carlo_dd_95pct": 0.0, "synthetic_sanity_passed": false, "verdict": "kept", "iteration": 1}
{"strategy_type": "sma_crossover", "params": {"fast_ma": 10, "strategy_type": "sma_crossover", "timeframe": "1h"}, "timerange": "20210101-", "regime": "", "sentiment_score": 0.0, "sharpe": 1.2, "win_rate": 0.6, "max_drawdown": -0.03, "total_trades": 50, "profit_factor": 1.0, "walk_forward_passed": false, "monte_carlo_dd_95pct": 0.0, "synthetic_sanity_passed": false, "verdict": "kept", "iteration": 1}
{"strategy_type": "sma_crossover", "params": {"fast_ma": 10, "slow_ma": 30, "strategy_type": "sma_crossover", "timeframe": "1h"}, "timerange": "20210101-", "regime": "", "sentiment_score": 0.0, "sharpe": 1.2, "win_rate": 0.6, "max_drawdown": -0.03, "total_trades": 50, "profit_factor": 1.0, "walk_forward_passed": false, "monte_carlo_dd_95pct": 0.0, "synthetic_sanity_passed": false, "verdict": "kept", "iteration": 1}
{"strategy_type": "sma_crossover", "params": {"fast_ma": 10, "strategy_type": "sma_crossover", "timeframe": "1h"}, "timerange": "20210101-", "regime": "", "sentiment_score": 0.0, "sharpe": 1.2, "win_rate": 0.6, "max_drawdown": -0.03, "total_trades": 50, "profit_factor": 1.0, "walk_forward_passed": false, "monte_carlo_dd_95pct": 0.0, "synthetic_sanity_passed": false, "verdict": "kept", "iteration": 1}
{"strategy_type": "sma_crossover", "params": {"fast_ma": 10, "slow_ma": 30, "strategy_type": "sma_crossover", "timeframe": "1h"}, "timerange": "20210101-", "regime": "", "sentiment_score": 0.0, "sharpe": 1.2, "win_rate": 0.6, "max_drawdown": -0.03, "total_trades": 50, "profit_factor": 1.0, "walk_forward_passed": false, "monte_carlo_dd_95pct": 0.0, "synthetic_sanity_passed": false, "verdict": "kept", "iteration": 1}
{"strategy_type": "sma_crossover", "params": {"fast_ma": 10, "strategy_type": "sma_crossover", "timeframe": "1h"}, "timerange": "20210101-", "regime": "", "sentiment_score": 0.0, "sharpe": 1.2, "win_rate": 0.6, "max_drawdown": -0.03, "total_trades": 50, "profit_factor": 1.0, "walk_forward_passed": false, "monte_carlo_dd_95pct": 0.0, "synthetic_sanity_passed": false, "verdict": "kept", "iteration": 1}
{"strategy_type": "sma_crossover", "params": {"fast_ma": 10, "slow_ma": 30, "strategy_type": "sma_crossover", "timeframe": "1h"}, "timerange": "20210101-", "regime": "", "sentiment_score": 0.0, "sharpe": 1.2, "win_rate": 0.6, "max_drawdown": -0.03, "total_trades": 50, "profit_factor": 1.0, "walk_forward_passed": false, "monte_carlo_dd_95pct": 0.0, "synthetic_sanity_passed": false, "verdict": "kept", "iteration": 1}
{"strategy_type": "sma_crossover", "params": {"fast_ma": 10, "strategy_type": "sma_crossover", "timeframe": "1h"}, "timerange": "20210101-", "regime": "", "sentiment_score": 0.0, "sharpe": 1.2, "win_rate": 0.6, "max_drawdown": -0.03, "total_trades": 50, "profit_factor": 1.0, "walk_forward_passed": false, "monte_carlo_dd_95pct": 0.0, "synthetic_sanity_passed": false, "verdict": "kept", "iteration": 1}
{"strategy_type": "sma_crossover", "params": {"fast_ma": 10, "slow_ma": 30, "strategy_type": "sma_crossover", "timeframe": "1h"}, "timerange": "20210101-", "regime": "", "sentiment_score": 0.0, "sharpe": 1.2, "win_rate": 0.6, "max_drawdown": -0.03, "total_trades": 50, "profit_factor": 1.0, "walk_forward_passed": false, "monte_carlo_dd_95pct": 0.0, "synthetic_sanity_passed": false, "verdict": "kept", "iteration": 1}
{"strategy_type": "sma_crossover", "params": {"fast_ma": 10, "strategy_type": "sma_crossover", "timeframe": "1h"}, "timerange": "20210101-", "regime": "", "sentiment_score": 0.0, "sharpe": 1.2, "win_rate": 0.6, "max_drawdown": -0.03, "total_trades": 50, "profit_factor": 1.0, "walk_forward_passed": false, "monte_carlo_dd_95pct": 0.0, "synthetic_sanity_passed": false, "verdict": "kept", "iteration": 1}
{"strategy_type": "sma_crossover", "params": {"fast_ma": 10, "slow_ma": 30, "strategy_type": "sma_crossover", "timeframe": "1h"}, "timerange": "20210101-", "regime": "", "sentiment_score": 0.0, "sharpe": 1.2, "win_rate": 0.6, "max_drawdown": -0.03, "total_trades": 50, "profit_factor": 1.0, "walk_forward_passed": false, "monte_carlo_dd_95pct": 0.0, "synthetic_sanity_passed": false, "verdict": "kept", "iteration": 1}
{"strategy_type": "sma_crossover", "params": {"fast_ma": 10, "strategy_type": "sma_crossover", "timeframe": "1h"}, "timerange": "20210101-", "regime": "", "sentiment_score": 0.0, "sharpe": 1.2, "win_rate": 0.6, "max_drawdown": -0.03, "total_trades": 50, "profit_factor": 1.0, "walk_forward_passed": false, "monte_carlo_dd_95pct": 0.0, "synthetic_sanity_passed": false, "verdict": "kept", "iteration": 1}
{"strategy_type": "sma_crossover", "params": {"fast_ma": 10, "slow_ma": 30, "strategy_type": "sma_crossover", "timeframe": "1h"}, "timerange": "20210101-", "regime": "", "sentiment_score": 0.0, "sharpe": 1.2, "win_rate": 0.6, "max_drawdown": -0.03, "total_trades": 50, "profit_factor": 1.0, "walk_forward_passed": false, "monte_carlo_dd_95pct": 0.0, "synthetic_sanity_passed": false, "verdict": "kept", "iteration": 1}
{"strategy_type": "sma_crossover", "params": {"fast_ma": 10, "strategy_type": "sma_crossover", "timeframe": "1h"}, "timerange": "20210101-", "regime": "", "sentiment_score": 0.0, "sharpe": 1.2, "win_rate": 0.6, "max_drawdown": -0.03, "total_trades": 50, "profit_factor": 1.0, "walk_forward_passed": false, "monte_carlo_dd_95pct": 0.0, "synthetic_sanity_passed": false, "verdict": "kept", "iteration": 1}
{"strategy_type": "sma_crossover", "params": {"fast_ma": 10, "slow_ma": 30, "strategy_type": "sma_crossover", "timeframe": "1h"}, "timerange": "20210101-", "regime": "", "sentiment_score": 0.0, "sharpe": 1.2, "win_rate": 0.6, "max_drawdown": -0.03, "total_trades": 50, "profit_factor": 1.0, "walk_forward_passed": false, "monte_carlo_dd_95pct": 0.0, "synthetic_sanity_passed": false, "verdict": "kept", "iteration": 1}
{"strategy_type": "sma_crossover", "params": {"fast_ma": 10, "strategy_type": "sma_crossover", "timeframe": "1h"}, "timerange": "20210101-", "regime": "", "sentiment_score": 0.0, "sharpe": 1.2, "win_rate": 0.6, "max_drawdown": -0.03, "total_trades": 50, "profit_factor": 1.0, "walk_forward_passed": false, "monte_carlo_dd_95pct": 0.0, "synthetic_sanity_passed": false, "verdict": "kept", "iteration": 1}
{"strategy_type": "sma_crossover", "params": {"fast_ma": 10, "slow_ma": 30, "strategy_type": "sma_crossover", "timeframe": "1h"}, "timerange": "20210101-", "regime": "", "sentiment_score": 0.0, "sharpe": 1.2, "win_rate": 0.6, "max_drawdown": -0.03, "total_trades": 50, "profit_factor": 1.0, "walk_forward_passed": false, "monte_carlo_dd_95pct": 0.0, "synthetic_sanity_passed": false, "verdict": "kept", "iteration": 1}
{"strategy_type": "sma_crossover", "params": {"fast_ma": 10, "strategy_type": "sma_crossover", "timeframe": "1h"}, "timerange": "20210101-", "regime": "", "sentiment_score": 0.0, "sharpe": 1.2, "win_rate": 0.6, "max_drawdown": -0.03, "total_trades": 50, "profit_factor": 1.0, "walk_forward_passed": false, "monte_carlo_dd_95pct": 0.0, "synthetic_sanity_passed": false, "verdict": "kept", "iteration": 1}
{"strategy_type": "sma_crossover", "params": {"fast_ma": 10, "slow_ma": 30, "strategy_type": "sma_crossover", "timeframe": "1h"}, "timerange": "20210101-", "regime": "", "sentiment_score": 0.0, "sharpe": 1.2, "win_rate": 0.6, "max_drawdown": -0.03, "total_trades": 50, "profit_factor": 1.0, "walk_forward_passed": false, "monte_carlo_dd_95pct": 0.0, "synthetic_sanity_passed": false, "verdict": "kept", "iteration": 1}
{"strategy_type": "sma_crossover", "params": {"fast_ma": 10, "strategy_type": "sma_crossover", "timeframe": "1h"}, "timerange": "20210101-", "regime": "", "sentiment_score": 0.0, "sharpe": 1.2, "win_rate": 0.6, "max_drawdown": -0.03, "total_trades": 50, "profit_factor": 1.0, "walk_forward_passed": false, "monte_carlo_dd_95pct": 0.0, "synthetic_sanity_passed": false, "verdict": "kept", "iteration": 1}
{"strategy_type": "sma_crossover", "params": {"fast_ma": 10, "slow_ma": 30, "strategy_type": "sma_crossover", "timeframe": "1h"}, "timerange": "20210101-", "regime": "", "sentiment_score": 0.0, "sharpe": 1.2, "win_rate": 0.6, "max_drawdown": -0.03, "total_trades": 50, "profit_factor": 1.0, "walk_forward_passed": false, "monte_carlo_dd_95pct": 0.0, "synthetic_sanity_passed": false, "verdict": "kept", "iteration": 1}
{"strategy_type": "sma_crossover", "params": {"fast_ma": 10, "strategy_type": "sma_crossover", "timeframe": "1h"}, "timerange": "20210101-", "regime": "", "sentiment_score": 0.0, "sharpe": 1.2, "win_rate": 0.6, "max_drawdown": -0.03, "total_trades": 50, "profit_factor": 1.0, "walk_forward_passed": false, "monte_carlo_dd_95pct": 0.0, "synthetic_sanity_passed": false, "verdict": "kept", "iteration": 1}
{"strategy_type": "sma_crossover", "params": {"fast_ma": 10, "slow_ma": 30, "strategy_type": "sma_crossover", "timeframe": "1h"}, "timerange": "20210101-", "regime": "", "sentiment_score": 0.0, "sharpe": 1.2, "win_rate": 0.6, "max_drawdown": -0.03, "total_trades": 50, "profit_factor": 1.0, "walk_forward_passed": false, "monte_carlo_dd_95pct": 0.0, "synthetic_sanity_passed": false, "verdict": "kept", "iteration": 1}
{"strategy_type": "sma_crossover", "params": {"fast_ma": 10, "strategy_type": "sma_crossover", "timeframe": "1h"}, "timerange": "20210101-", "regime": "", "sentiment_score": 0.0, "sharpe": 1.2, "win_rate": 0.6, "max_drawdown": -0.03, "total_trades": 50, "profit_factor": 1.0, "walk_forward_passed": false, "monte_carlo_dd_95pct": 0.0, "synthetic_sanity_passed": false, "verdict": "kept", "iteration": 1}
{"strategy_type": "sma_crossover", "params": {"fast_ma": 10, "slow_ma": 30, "strategy_type": "sma_crossover", "timeframe": "1h"}, "timerange": "20210101-", "regime": "", "sentiment_score": 0.0, "sharpe": 1.2, "win_rate": 0.6, "max_drawdown": -0.03, "total_trades": 50, "profit_factor": 1.0, "walk_forward_passed": false, "monte_carlo_dd_95pct": 0.0, "synthetic_sanity_passed": false, "verdict": "kept", "iteration": 1}
{"strategy_type": "sma_crossover", "params": {"fast_ma": 10, "strategy_type": "sma_crossover", "timeframe": "1h"}, "timerange": "20210101-", "regime": "", "sentiment_score": 0.0, "sharpe": 1.2, "win_rate": 0.6, "max_drawdown": -0.03, "total_trades": 50, "profit_factor": 1.0, "walk_forward_passed": false, "monte_carlo_dd_95pct": 0.0, "synthetic_sanity_passed": false, "verdict": "kept", "iteration": 1}
{"strategy_type": "sma_crossover", "params": {"fast_ma": 10, "slow_ma": 30, "strategy_type": "sma_crossover", "timeframe": "1h"}, "timerange": "20210101-", "regime": "", "sentiment_score": 0.0, "sharpe": 1.2, "win_rate": 0.6, "max_drawdown": -0.03, "total_trades": 50, "profit_factor": 1.0, "walk_forward_passed": false, "monte_carlo_dd_95pct": 0.0, "synthetic_sanity_passed": false, "verdict": "kept", "iteration": 1}
{"strategy_type": "sma_crossover", "params": {"fast_ma": 10, "strategy_type": "sma_crossover", "timeframe": "1h"}, "timerange": "20210101-", "regime": "", "sentiment_score": 0.0, "sharpe": 1.2, "win_rate": 0.6, "max_drawdown": -0.03, "total_trades": 50, "profit_factor": 1.0, "walk_forward_passed": false, "monte_carlo_dd_95pct": 0.0, "synthetic_sanity_passed": false, "verdict": "kept", "iteration": 1}
{"strategy_type": "sma_crossover", "params": {"fast_ma": 10, "slow_ma": 30, "strategy_type": "sma_crossover", "timeframe": "1h"}, "timerange": "20210101-", "regime": "", "sentiment_score": 0.0, "sharpe": 1.2, "win_rate": 0.6, "max_drawdown": -0.03, "total_trades": 50, "profit_factor": 1.0, "walk_forward_passed": false, "monte_carlo_dd_95pct": 0.0, "synthetic_sanity_passed": false, "verdict": "kept", "iteration": 1}
{"strategy_type": "sma_crossover", "params": {"fast_ma": 10, "strategy_type": "sma_crossover", "timeframe": "1h"}, "timerange": "20210101-", "regime": "", "sentiment_score": 0.0, "sharpe": 1.2, "win_rate": 0.6, "max_drawdown": -0.03, "total_trades": 50, "profit_factor": 1.0, "walk_forward_passed": false, "monte_carlo_dd_95pct": 0.0, "synthetic_sanity_passed": false, "verdict": "kept", "iteration": 1}
{"strategy_type": "sma_crossover", "params": {"fast_ma": 10, "slow_ma": 30, "strategy_type": "sma_crossover", "timeframe": "1h"}, "timerange": "20210101-", "regime": "", "sentiment_score": 0.0, "sharpe": 1.2, "win_rate": 0.6, "max_drawdown": -0.03, "total_trades": 50, "profit_factor": 1.0, "walk_forward_passed": false, "monte_carlo_dd_95pct": 0.0, "synthetic_sanity_passed": false, "verdict": "kept", "iteration": 1}
{"strategy_type": "sma_crossover", "params": {"fast_ma": 10, "strategy_type": "sma_crossover", "timeframe": "1h"}, "timerange": "20210101-", "regime": "", "sentiment_score": 0.0, "sharpe": 1.2, "win_rate": 0.6, "max_drawdown": -0.03, "total_trades": 50, "profit_factor": 1.0, "walk_forward_passed": false, "monte_carlo_dd_95pct": 0.0, "synthetic_sanity_passed": false, "verdict": "kept", "iteration": 1}
{"strategy_type": "sma_crossover", "params": {"fast_ma": 10, "slow_ma": 30, "strategy_type": "sma_crossover", "timeframe": "1h"}, "timerange": "20210101-", "regime": "", "sentiment_score": 0.0, "sharpe": 1.2, "win_rate": 0.6, "max_drawdown": -0.03, "total_trades": 50, "profit_factor": 1.0, "walk_forward_passed": false, "monte_carlo_dd_95pct": 0.0, "synthetic_sanity_passed": false, "verdict": "kept", "iteration": 1}
{"strategy_type": "sma_crossover", "params": {"fast_ma": 10, "strategy_type": "sma_crossover", "timeframe": "1h"}, "timerange": "20210101-", "regime": "", "sentiment_score": 0.0, "sharpe": 1.2, "win_rate": 0.6, "max_drawdown": -0.03, "total_trades": 50, "profit_factor": 1.0, "walk_forward_passed": false, "monte_carlo_dd_95pct": 0.0, "synthetic_sanity_passed": false, "verdict": "kept", "iteration": 1}
{"strategy_type": "sma_crossover", "params": {"fast_ma": 10, "slow_ma": 30, "strategy_type": "sma_crossover", "timeframe": "1h"}, "timerange": "20210101-", "regime": "", "sentiment_score": 0.0, "sharpe": 1.2, "win_rate": 0.6, "max_drawdown": -0.03, "total_trades": 50, "profit_factor": 1.0, "walk_forward_passed": false, "monte_carlo_dd_95pct": 0.0, "synthetic_sanity_passed": false, "verdict": "kept", "iteration": 1}
{"strategy_type": "sma_crossover", "params": {"fast_ma": 10, "strategy_type": "sma_crossover", "timeframe": "1h"}, "timerange": "20210101-", "regime": "", "sentiment_score": 0.0, "sharpe": 1.2, "win_rate": 0.6, "max_drawdown": -0.03, "total_trades": 50, "profit_factor": 1.0, "walk_forward_passed": false, "monte_carlo_dd_95pct": 0.0, "synthetic_sanity_passed": false, "verdict": "kept", "iteration": 1}
{"strategy_type": "sma_crossover", "params": {"fast_ma": 10, "slow_ma": 30, "strategy_type": "sma_crossover", "timeframe": "1h"}, "timerange": "20210101-", "regime": "", "sentiment_score": 0.0, "sharpe": 1.2, "win_rate": 0.6, "max_drawdown": -0.03, "total_trades": 50, "profit_factor": 1.0, "walk_forward_passed": false, "monte_carlo_dd_95pct": 0.0, "synthetic_sanity_passed": false, "verdict": "kept", "iteration": 1}
{"strategy_type": "sma_crossover", "params": {"fast_ma": 10, "strategy_type": "sma_crossover", "timeframe": "1h"}, "timerange": "20210101-", "regime": "", "sentiment_score": 0.0, "sharpe": 1.2, "win_rate": 0.6, "max_drawdown": -0.03, "total_trades": 50, "profit_factor": 1.0, "walk_forward_passed": false, "monte_carlo_dd_95pct": 0.0, "synthetic_sanity_passed": false, "verdict": "kept", "iteration": 1}
{"strategy_type": "sma_crossover", "params": {"fast_ma": 10, "slow_ma": 30, "strategy_type": "sma_crossover", "timeframe": "1h"}, "timerange": "20210101-", "regime": "", "sentiment_score": 0.0, "sharpe": 1.2, "win_rate": 0.6, "max_drawdown": -0.03, "total_trades": 50, "profit_factor": 1.0, "walk_forward_passed": false, "monte_carlo_dd_95pct": 0.0, "synthetic_sanity_passed": false, "verdict": "kept", "iteration": 1}
