{"strategy_type": "bollinger_bands", "params": {"params": {"bb_period": 20, "bb_std": 2.0}, "stoploss": -0.05, "timeframe": "1h", "_strategy_id": "c693510d"}, "timerange": "20260427-20260530", "regime": "", "sentiment_score": 0.0, "sharpe": 0.440202274352654, "win_rate": 0.5454545454545454, "max_drawdown": 0.0002656542906092053, "total_trades": 11, "verdict": "discarded", "iteration": 1}
{"strategy_type": "combined_sma_rsi", "params": {"params": {"fast_ma": 10, "slow_ma": 30, "rsi_period": 14, "rsi_threshold": 50}, "stoploss": -0.05, "fast_ma": 10, "slow_ma": 30, "timeframe": "1h", "_strategy_id": "d6a73dca"}, "timerange": "20260427-20260530", "regime": "", "sentiment_score": 0.0, "sharpe": -2.5361708423350686, "win_rate": 0.35714285714285715, "max_drawdown": 0.0005452832605089505, "total_trades": 14, "verdict": "discarded", "iteration": 2}
{"strategy_type": "rsi_oversold", "params": {"params": {"rsi_period": 14, "rsi_oversold": 30, "rsi_overbought": 70}, "stoploss": -0.05, "timeframe": "1h", "_strategy_id": "8da6f99a"}, "timerange": "20260427-20260530", "regime": "", "sentiment_score": 0.0, "sharpe": -1.0943371969671103, "win_rate": 0.6, "max_drawdown": 0.0007563803098497058, "total_trades": 5, "verdict": "discarded", "iteration": 3}
{"strategy_type": "breakout", "params": {"params": {"lookback_period": 20, "volume_threshold": 1.5}, "stoploss": -0.05, "timeframe": "1h", "_strategy_id": "b8caad15"}, "timerange": "20260427-20260530", "regime": "", "sentiment_score": 0.0, "sharpe": -4.714710948001745, "win_rate": 0.23529411764705882, "max_drawdown": 0.000690554598000017, "total_trades": 17, "verdict": "discarded", "iteration": 4}
{"strategy_type": "bollinger_bands", "params": {"params": {"bb_period": 20, "bb_std": 1.5}, "stoploss": -0.05, "timeframe": "1h", "_strategy_id": "8f8884b7"}, "timerange": "20260427-20260530", "regime": "", "sentiment_score": 0.0, "sharpe": 0.440202274352654, "win_rate": 0.5454545454545454, "max_drawdown": 0.0002656542906092053, "total_trades": 11, "verdict": "discarded", "iteration": 5}
{"strategy_type": "macd_crossover", "params": {"params": {"macd_fast": 12, "macd_slow": 26, "macd_signal": 9}, "stoploss": -0.05, "timeframe": "1h", "_strategy_id": "322e5ee2"}, "timerange": "20260427-20260530", "regime": "", "sentiment_score": 0.0, "sharpe": -8.581758743928185, "win_rate": 0.2727272727272727, "max_drawdown": 0.0012001573761710944, "total_trades": 33, "verdict": "discarded", "iteration": 6}
{"strategy_type": "sma_crossover", "params": {"params": {"fast_ma": 5, "slow_ma": 20}, "stoploss": -0.05, "fast_ma": 10, "slow_ma": 30, "timeframe": "1h", "_strategy_id": "fccca372"}, "timerange": "20260427-20260530", "regime": "", "sentiment_score": 0.0, "sharpe": -2.5361708423350686, "win_rate": 0.35714285714285715, "max_drawdown": 0.0005452832605089505, "total_trades": 14, "verdict": "discarded", "iteration": 7}
{"strategy_type": "momentum", "params": {"params": {"roc_period": 10, "volume_ma_period": 20}, "stoploss": -0.05, "timeframe": "1h", "_strategy_id": "b192860b"}, "timerange": "20260427-20260530", "regime": "", "sentiment_score": 0.0, "sharpe": -3.6461185002264336, "win_rate": 0.0, "max_drawdown": 0.0003792347250000603, "total_trades": 3, "verdict": "discarded", "iteration": 8}
{"strategy_type": "multi_timeframe", "params": {"params": {"fast_ma": 10, "slow_ma": 30, "higher_tf_ma": 200, "adx_period": 14, "adx_threshold": 25}, "stoploss": -0.05, "timeframe": "1h", "_strategy_id": "8b5fc6d5"}, "timerange": "20260427-20260530", "regime": "", "sentiment_score": 0.0, "sharpe": -100.0, "win_rate": 0.0, "max_drawdown": 0.00014619950800006336, "total_trades": 1, "verdict": "discarded", "iteration": 9}
{"strategy_type": "sentiment_driven", "params": {"params": {"rsi_period": 14, "rsi_oversold": 30, "sma_period": 50}, "stoploss": -0.05, "timeframe": "1h", "_strategy_id": "7003ae3c"}, "timerange": "20260427-20260530", "regime": "", "sentiment_score": 0.0, "sharpe": 0, "win_rate": 0, "max_drawdown": 0, "total_trades": 0, "verdict": "discarded", "iteration": 10}
{"strategy_type": "bollinger_bands", "params": {"params": {"bb_period": 10, "bb_std": 2.0}, "stoploss": -0.05, "timeframe": "1h", "_strategy_id": "b1e9477b"}, "timerange": "20260427-20260530", "regime": "", "sentiment_score": 0.0, "sharpe": 0.440202274352654, "win_rate": 0.5454545454545454, "max_drawdown": 0.0002656542906092053, "total_trades": 11, "verdict": "discarded", "iteration": 11}
{"strategy_type": "bollinger_bands", "params": {"params": {"bb_period": 20, "bb_std": 2.0}, "stoploss": -0.05, "timeframe": "1h", "_strategy_id": "c693510d"}, "timerange": "20260401-20260530", "regime": "", "sentiment_score": 0.0, "sharpe": 1.1171895853127223, "win_rate": 0.5789473684210527, "max_drawdown": 0.0002655872267040415, "total_trades": 19, "verdict": "kept", "iteration": 12}
{"strategy_type": "combined_sma_rsi", "params": {"params": {"fast_ma": 5, "slow_ma": 15, "rsi_period": 7, "rsi_threshold": 50}, "stoploss": -0.05, "fast_ma": 10, "slow_ma": 30, "timeframe": "1h", "_strategy_id": "2f7dda06"}, "timerange": "20260401-20260530", "regime": "", "sentiment_score": 0.0, "sharpe": -0.4864534079608963, "win_rate": 0.48, "max_drawdown": 0.000545112864482935, "total_trades": 25, "verdict": "discarded", "iteration": 13}
{"strategy_type": "rsi_oversold", "params": {"params": {"rsi_period": 7, "rsi_oversold": 25, "rsi_overbought": 75}, "stoploss": -0.05, "timeframe": "1h", "_strategy_id": "e4f5ad4f"}, "timerange": "20260401-20260530", "regime": "", "sentiment_score": 0.0, "sharpe": -0.2388907216178489, "win_rate": 0.75, "max_drawdown": 0.0007561538715378398, "total_trades": 8, "verdict": "discarded", "iteration": 14}
{"strategy_type": "bollinger_bands", "params": {"params": {"bb_period": 20, "bb_std": 2.0, "stoploss": -0.02}, "stoploss": -0.05, "timeframe": "1h", "_strategy_id": "05713088"}, "timerange": "20260401-20260530", "regime": "", "sentiment_score": 0.0, "sharpe": 1.1171895853127223, "win_rate": 0.5789473684210527, "max_drawdown": 0.0002655872267040415, "total_trades": 19, "verdict": "kept", "iteration": 15}
{"strategy_type": "sma_crossover", "params": {"params": {"fast_ma": 3, "slow_ma": 10}, "stoploss": -0.05, "fast_ma": 10, "slow_ma": 30, "timeframe": "1h", "_strategy_id": "f3ff245d"}, "timerange": "20260401-20260530", "regime": "", "sentiment_score": 0.0, "sharpe": -0.21236305880285208, "win_rate": 0.5, "max_drawdown": 0.0005450586492976846, "total_trades": 26, "verdict": "discarded", "iteration": 16}
{"strategy_type": "bollinger_bands", "params": {"params": {"bb_period": 20, "bb_std": 2.0}, "stoploss": -0.05, "timeframe": "1h", "_strategy_id": "c693510d"}, "timerange": "20260427-20260530", "regime": "", "sentiment_score": 0.0, "sharpe": 0.440202274352654, "win_rate": 0.5454545454545454, "max_drawdown": 0.0002656542906092053, "total_trades": 11, "verdict": "discarded", "iteration": 17}
{"strategy_type": "momentum", "params": {"params": {"roc_period": 14, "volume_ratio": 1.5, "adx_threshold": 25, "adx_period": 14}, "stoploss": -0.05, "timeframe": "1h", "_strategy_id": "09c6cae6"}, "timerange": "20260427-20260527", "regime": "", "sentiment_score": 0.0, "sharpe": -3.889193066908196, "win_rate": 0.0, "max_drawdown": 0.0003792347250000603, "total_trades": 3, "verdict": "discarded", "iteration": 1}
{"strategy_type": "bollinger_bands", "params": {"params": {"bb_period": 20, "bb_std": 2.0}, "stoploss": -0.05, "timeframe": "1h", "_strategy_id": "729bcb96"}, "timerange": "20260427-20260527", "regime": "", "sentiment_score": 0.0, "sharpe": 3.3004449017849273, "win_rate": 0.5454545454545454, "max_drawdown": 0.00011880258886272148, "total_trades": 11, "verdict": "kept", "iteration": 2}
{"strategy_type": "rsi_oversold", "params": {"params": {"rsi_period": 14, "rsi_oversold": 30, "rsi_overbought": 70}, "stoploss": -0.05, "timeframe": "1h", "_strategy_id": "ef1ee43a"}, "timerange": "20260427-20260527", "regime": "", "sentiment_score": 0.0, "sharpe": -0.5179059514203251, "win_rate": 0.75, "max_drawdown": 0.0005153748614024329, "total_trades": 4, "verdict": "discarded", "iteration": 3}
{"strategy_type": "combined_sma_rsi", "params": {"params": {"fast_ma": 10, "slow_ma": 30, "rsi_period": 14, "rsi_threshold": 50}, "stoploss": -0.05, "fast_ma": 10, "slow_ma": 30, "timeframe": "1h", "_strategy_id": "6c29aaad"}, "timerange": "20260427-20260527", "regime": "", "sentiment_score": 0.0, "sharpe": -2.4781811665271847, "win_rate": 0.38461538461538464, "max_drawdown": 0.0005210170878429646, "total_trades": 13, "verdict": "discarded", "iteration": 4}
{"strategy_type": "bollinger_bands", "params": {"params": {"bb_period": 20, "bb_std": 2.5}, "stoploss": -0.05, "timeframe": "1h", "_strategy_id": "3f319fef"}, "timerange": "20260427-20260527", "regime": "", "sentiment_score": 0.0, "sharpe": 3.3004449017849273, "win_rate": 0.5454545454545454, "max_drawdown": 0.00011880258886272148, "total_trades": 11, "verdict": "kept", "iteration": 5}
{"strategy_type": "bollinger_bands", "params": {"params": {"bb_period": 14, "bb_std": 2.0}, "stoploss": -0.05, "timeframe": "1h", "_strategy_id": "939613d7"}, "timerange": "20260427-20260527", "regime": "", "sentiment_score": 0.0, "sharpe": 3.3004449017849273, "win_rate": 0.5454545454545454, "max_drawdown": 0.00011880258886272148, "total_trades": 11, "verdict": "kept", "iteration": 6}
{"strategy_type": "sentiment_driven", "params": {"params": {"rsi_period": 14, "sma_period": 50, "sentiment_threshold": 30}, "stoploss": -0.05, "timeframe": "1h", "_strategy_id": "88b5d2ab"}, "timerange": "20260427-20260527", "regime": "", "sentiment_score": 0.0, "sharpe": 0, "win_rate": 0, "max_drawdown": 0, "total_trades": 0, "verdict": "discarded", "iteration": 7}
{"strategy_type": "breakout", "params": {"params": {"lookback_period": 20, "volume_ratio": 1.5}, "stoploss": -0.05, "timeframe": "1h", "_strategy_id": "eaa0d9ce"}, "timerange": "20260427-20260527", "regime": "", "sentiment_score": 0.0, "sharpe": -5.0290250112018615, "win_rate": 0.23529411764705882, "max_drawdown": 0.000690554598000017, "total_trades": 17, "verdict": "discarded", "iteration": 8}
{"strategy_type": "sma_crossover", "params": {"params": {"fast_ma": 7, "slow_ma": 21}, "stoploss": -0.05, "fast_ma": 10, "slow_ma": 30, "timeframe": "1h", "_strategy_id": "67031f54"}, "timerange": "20260427-20260527", "regime": "", "sentiment_score": 0.0, "sharpe": -2.4781811665271847, "win_rate": 0.38461538461538464, "max_drawdown": 0.0005210170878429646, "total_trades": 13, "verdict": "discarded", "iteration": 9}
{"strategy_type": "multi_timeframe", "params": {"params": {"fast_ma": 10, "slow_ma": 30, "higher_tf_ma": 200, "adx_threshold": 25}, "stoploss": -0.05, "timeframe": "1h", "_strategy_id": "c92eef01"}, "timerange": "20260427-20260527", "regime": "", "sentiment_score": 0.0, "sharpe": -100.0, "win_rate": 0.0, "max_drawdown": 0.00014619950800006336, "total_trades": 1, "verdict": "discarded", "iteration": 10}
{"strategy_type": "sma_crossover", "params": {"params": {"fast_ma": 5, "slow_ma": 13}, "stoploss": -0.05, "fast_ma": 10, "slow_ma": 30, "timeframe": "1h", "_strategy_id": "1c88a42e"}, "timerange": "20260427-20260527", "regime": "", "sentiment_score": 0.0, "sharpe": -2.4781811665271847, "win_rate": 0.38461538461538464, "max_drawdown": 0.0005210170878429646, "total_trades": 13, "verdict": "discarded", "iteration": 11}
{"strategy_type": "bollinger_bands", "params": {"params": {"bb_period": 20, "bb_std": 2.0, "stoploss": -0.03}, "stoploss": -0.05, "timeframe": "1h", "_strategy_id": "b18597fb"}, "timerange": "20260427-20260527", "regime": "", "sentiment_score": 0.0, "sharpe": 3.3004449017849273, "win_rate": 0.5454545454545454, "max_drawdown": 0.00011880258886272148, "total_trades": 11, "verdict": "kept", "iteration": 12}
{"strategy_type": "macd_crossover", "params": {"params": {"macd_fast": 12, "macd_slow": 26, "macd_signal": 9}, "stoploss": -0.05, "timeframe": "1h", "_strategy_id": "30648d44"}, "timerange": "20260427-20260527", "regime": "", "sentiment_score": 0.0, "sharpe": -6.8404619267574756, "win_rate": 0.3, "max_drawdown": 0.0009127077542465884, "total_trades": 30, "verdict": "discarded", "iteration": 13}
{"strategy_type": "rsi_oversold", "params": {"params": {}, "stoploss": -0.05, "timeframe": "1h", "_strategy_id": "6cf33608"}, "timerange": "20210527-20260527", "regime": "", "sentiment_score": 0.0, "sharpe": -0.4103637182381089, "win_rate": 0.7823691460055097, "max_drawdown": 0.009752072776017614, "total_trades": 363, "verdict": "discarded", "iteration": 1}
{"strategy_type": "bollinger_bands", "params": {"params": {}, "stoploss": -0.05, "timeframe": "1h", "_strategy_id": "72eb5448"}, "timerange": "20210527-20260527", "regime": "", "sentiment_score": 0.0, "sharpe": -0.801796381750975, "win_rate": 0.7202007528230866, "max_drawdown": 0.017494372969401973, "total_trades": 797, "verdict": "discarded", "iteration": 2}
{"strategy_type": "combined_sma_rsi", "params": {"params": {}, "stoploss": -0.05, "fast_ma": 10, "slow_ma": 30, "timeframe": "1h", "_strategy_id": "f8829b8a"}, "timerange": "20210527-20260527", "regime": "", "sentiment_score": 0.0, "sharpe": -1.0780827806686553, "win_rate": 0.5035971223021583, "max_drawdown": 0.01469915980200003, "total_trades": 834, "verdict": "discarded", "iteration": 3}
{"strategy_type": "sentiment_driven", "params": {"params": {}, "stoploss": -0.05, "timeframe": "1h", "_strategy_id": "8022e78e"}, "timerange": "20210527-20260527", "regime": "", "sentiment_score": 0.0, "sharpe": 9.009879610866385e-05, "win_rate": 0.45454545454545453, "max_drawdown": 0.000378823958419134, "total_trades": 11, "verdict": "discarded", "iteration": 4}
{"strategy_type": "custom", "params": {"startup_candle_count": 15, "stoploss": -0.05, "timeframe": "1h", "_strategy_id": "21acc27c"}, "timerange": "20210527-20260527", "regime": "", "sentiment_score": 0.0, "sharpe": -0.5748371542036818, "win_rate": 0.7780269058295964, "max_drawdown": 0.014207369642171069, "total_trades": 446, "verdict": "discarded", "iteration": 5}
{"strategy_type": "custom", "params": {"startup_candle_count": 200, "stoploss": -0.05, "timeframe": "1h", "_strategy_id": "faaf6101"}, "timerange": "20210527-20260527", "regime": "", "sentiment_score": 0.0, "sharpe": -0.0952859158943319, "win_rate": 0.46511627906976744, "max_drawdown": 0.0017277072233760596, "total_trades": 43, "verdict": "discarded", "iteration": 6}
{"strategy_type": "custom", "params": {"startup_candle_count": 25, "stoploss": -0.05, "timeframe": "1h", "_strategy_id": "935984ba"}, "timerange": "20210527-20260527", "regime": "", "sentiment_score": 0.0, "sharpe": -0.2796919711904486, "win_rate": 0.7651821862348178, "max_drawdown": 0.007718529399823875, "total_trades": 247, "verdict": "discarded", "iteration": 7}
{"strategy_type": "custom", "params": {"startup_candle_count": 65, "stoploss": -0.05, "timeframe": "1h", "_strategy_id": "833a20c2"}, "timerange": "20210527-20260527", "regime": "", "sentiment_score": 0.0, "sharpe": -0.09575652241239184, "win_rate": 0.7111111111111111, "max_drawdown": 0.002683893087965007, "total_trades": 45, "verdict": "discarded", "iteration": 8}
{"strategy_type": "custom", "params": {"startup_candle_count": 5, "stoploss": -0.05, "timeframe": "1h", "_strategy_id": "68313d54"}, "timerange": "20210527-20260527", "regime": "", "sentiment_score": 0.0, "sharpe": -2.8903096623751106, "win_rate": 0.5767615492300513, "max_drawdown": 0.03553747161064133, "total_trades": 2143, "verdict": "discarded", "iteration": 9}
{"strategy_type": "breakout", "params": {"params": {}, "stoploss": -0.05, "timeframe": "1h", "_strategy_id": "c5dc2980"}, "timerange": "20210527-20260527", "regime": "", "sentiment_score": 0.0, "sharpe": -1.5088138269855504, "win_rate": 0.5111111111111111, "max_drawdown": 0.019702508564040034, "total_trades": 1170, "verdict": "discarded", "iteration": 10}
{"strategy_type": "momentum", "params": {"params": {}, "stoploss": -0.05, "timeframe": "1h", "_strategy_id": "6504d666"}, "timerange": "20210527-20260527", "regime": "", "sentiment_score": 0.0, "sharpe": -0.6817946762833327, "win_rate": 0.5641509433962264, "max_drawdown": 0.011708379618847586, "total_trades": 530, "verdict": "discarded", "iteration": 11}
{"strategy_type": "custom", "params": {"startup_candle_count": 100, "stoploss": -0.05, "timeframe": "1h", "_strategy_id": "208c566d"}, "timerange": "20210527-20260527", "regime": "", "sentiment_score": 0.0, "sharpe": -0.2656362770757734, "win_rate": 0.7327188940092166, "max_drawdown": 0.006763678465768823, "total_trades": 217, "verdict": "discarded", "iteration": 12}
{"strategy_type": "custom", "params": {"startup_candle_count": 200, "stoploss": -0.05, "timeframe": "1h", "_strategy_id": "e481ab10"}, "timerange": "20210527-20260527", "regime": "", "sentiment_score": 0.0, "sharpe": -0.0077636084802823685, "win_rate": 0.8, "max_drawdown": 0.0010372029039490186, "total_trades": 25, "verdict": "discarded", "iteration": 13}
{"strategy_type": "custom", "params": {"startup_candle_count": 200, "stoploss": -0.05, "timeframe": "1h", "_strategy_id": "693a1bbf"}, "timerange": "20210527-20260527", "regime": "", "sentiment_score": 0.0, "sharpe": -0.025641485843414653, "win_rate": 0.5714285714285714, "max_drawdown": 0.0007619909133838236, "total_trades": 7, "verdict": "discarded", "iteration": 14}
{"strategy_type": "custom", "params": {"startup_candle_count": 200, "stoploss": -0.05, "timeframe": "1h", "_strategy_id": "56b74b5c"}, "timerange": "20210527-20260527", "regime": "", "sentiment_score": 0.0, "sharpe": -0.0077636084802823685, "win_rate": 0.8, "max_drawdown": 0.0010372029039490186, "total_trades": 25, "verdict": "discarded", "iteration": 15}
{"strategy_type": "multi_timeframe", "params": {"params": {}, "stoploss": -0.05, "timeframe": "1h", "_strategy_id": "2ce3f80c"}, "timerange": "20210527-20260527", "regime": "", "sentiment_score": 0.0, "sharpe": -0.17740027805319367, "win_rate": 0.514018691588785, "max_drawdown": 0.0034093434716609672, "total_trades": 107, "verdict": "discarded", "iteration": 16}
{"strategy_type": "sma_crossover", "params": {"params": {"fast_ma": 10, "slow_ma": 30}, "stoploss": -0.05, "fast_ma": 10, "slow_ma": 30, "timeframe": "1h", "_strategy_id": "6d415535"}, "timerange": "20210527-20260527", "regime": "", "sentiment_score": 0.0, "sharpe": -0.9395999496666035, "win_rate": 0.5187713310580204, "max_drawdown": 0.013025475777000065, "total_trades": 879, "verdict": "discarded", "iteration": 17}
{"strategy_type": "sma_crossover", "params": {"params": {"fast_ma": 50, "slow_ma": 200}, "stoploss": -0.05, "fast_ma": 10, "slow_ma": 30, "timeframe": "1h", "_strategy_id": "2ee449fb"}, "timerange": "20210527-20260527", "regime": "", "sentiment_score": 0.0, "sharpe": -0.9395999496666035, "win_rate": 0.5187713310580204, "max_drawdown": 0.013025475777000065, "total_trades": 879, "verdict": "discarded", "iteration": 18}
{"strategy_type": "sma_crossover", "params": {"fast_ma": 50, "slow_ma": 200, "stoploss": -0.05, "timeframe": "1h", "_strategy_id": "2534638b"}, "timerange": "20210527-20260527", "regime": "", "sentiment_score": 0.0, "sharpe": -0.06538938762347583, "win_rate": 0.7086092715231788, "max_drawdown": 0.0038918733903978656, "total_trades": 151, "verdict": "discarded", "iteration": 19}
{"strategy_type": "custom", "params": {"startup_candle_count": 200, "stoploss": -0.05, "timeframe": "1h", "_strategy_id": "ee244dbe"}, "timerange": "20210527-20260527", "regime": "", "sentiment_score": 0.0, "sharpe": -0.06015322430065161, "win_rate": 0.7105263157894737, "max_drawdown": 0.0038914858763030346, "total_trades": 152, "verdict": "discarded", "iteration": 20}
{"strategy_type": "custom", "params": {"startup_candle_count": 200, "stoploss": -0.05, "timeframe": "1h", "_strategy_id": "bd53a8cc"}, "timerange": "20210527-20260527", "regime": "", "sentiment_score": 0.0, "sharpe": -0.011097821706583895, "win_rate": 0.72, "max_drawdown": 0.0011087828706393737, "total_trades": 25, "verdict": "discarded", "iteration": 21}
{"strategy_type": "custom", "params": {"startup_candle_count": 200, "stoploss": -0.05, "timeframe": "1h", "_strategy_id": "00ef54dd"}, "timerange": "20210527-20260527", "regime": "", "sentiment_score": 0.0, "sharpe": -0.014589998172047133, "win_rate": 0.76, "max_drawdown": 0.0013282169799905482, "total_trades": 25, "verdict": "discarded", "iteration": 22}
{"strategy_type": "custom", "params": {"startup_candle_count": 200, "stoploss": -0.05, "timeframe": "1h", "_strategy_id": "3019bec8"}, "timerange": "20210527-20260527", "regime": "", "sentiment_score": 0.0, "sharpe": -0.2063415325075342, "win_rate": 0.525, "max_drawdown": 0.004014473056157224, "total_trades": 80, "verdict": "discarded", "iteration": 23}
{"strategy_type": "macd_crossover", "params": {"params": {}, "stoploss": -0.05, "timeframe": "1h", "_strategy_id": "0045ac09"}, "timerange": "20210527-20260527", "regime": "", "sentiment_score": 0.0, "sharpe": -2.8560462876168713, "win_rate": 0.44949193066347876, "max_drawdown": 0.03518384785330332, "total_trades": 1673, "verdict": "discarded", "iteration": 24}
{"strategy_type": "custom", "params": {"startup_candle_count": 200, "stoploss": -0.05, "timeframe": "1h", "_strategy_id": "e481ab10"}, "timerange": "20260427-20260527", "regime": "", "sentiment_score": 0.0, "sharpe": 0, "win_rate": 0, "max_drawdown": 0, "total_trades": 0, "verdict": "discarded", "iteration": 25}
{"strategy_type": "custom", "params": {"startup_candle_count": 200, "stoploss": -0.05, "timeframe": "1h", "_strategy_id": "50ba8aca"}, "timerange": "20210527-20260527", "regime": "", "sentiment_score": 0.0, "sharpe": -0.0077636084802823685, "win_rate": 0.8, "max_drawdown": 0.0010372029039490186, "total_trades": 25, "verdict": "discarded", "iteration": 26}
