{"strategy_type": "custom", "params": {"startup_candle_count": 200, "stoploss": -0.05, "timeframe": "1h", "_strategy_id": "cf994c6a"}, "timerange": "20210527-20260527", "regime": "", "sentiment_score": 0.0, "sharpe": -0.08282542995708579, "win_rate": 0.6296296296296297, "max_drawdown": 0.0018961424517530549, "total_trades": 54, "verdict": "discarded", "iteration": 27}
{"strategy_type": "custom", "params": {"startup_candle_count": 200, "stoploss": -0.05, "timeframe": "1h", "_strategy_id": "9a199eff"}, "timerange": "20210527-20260527", "regime": "", "sentiment_score": 0.0, "sharpe": -0.09577087319665675, "win_rate": 0.5813953488372093, "max_drawdown": 0.0019714274311040513, "total_trades": 43, "verdict": "discarded", "iteration": 28}
{"strategy_type": "combined_sma_rsi", "params": {"fast_ma": 20, "slow_ma": 50, "stoploss": -0.05, "timeframe": "1h", "_strategy_id": "9ff0eabb"}, "timerange": "20210527-20260527", "regime": "", "sentiment_score": 0.0, "sharpe": -0.6057030973532793, "win_rate": 0.5599128540305011, "max_drawdown": 0.01163457808674742, "total_trades": 459, "verdict": "discarded", "iteration": 29}
{"strategy_type": "custom", "params": {"startup_candle_count": 50, "stoploss": -0.05, "timeframe": "1h", "_strategy_id": "c7cd4ebf"}, "timerange": "20210527-20260527", "regime": "", "sentiment_score": 0.0, "sharpe": 0, "win_rate": 0, "max_drawdown": 0, "total_trades": 0, "verdict": "discarded", "iteration": 30}
{"strategy_type": "custom", "params": {"startup_candle_count": 50, "stoploss": -0.05, "timeframe": "1h", "_strategy_id": "a2c44eac"}, "timerange": "20210527-20260527", "regime": "", "sentiment_score": 0.0, "sharpe": -0.5785767671146597, "win_rate": 0.7775280898876404, "max_drawdown": 0.014208787309402025, "total_trades": 445, "verdict": "discarded", "iteration": 31}
{"strategy_type": "custom", "params": {"startup_candle_count": 100, "stoploss": -0.05, "timeframe": "1h", "_strategy_id": "bcfcd85c"}, "timerange": "20210527-20260527", "regime": "", "sentiment_score": 0.0, "sharpe": 0, "win_rate": 0, "max_drawdown": 0, "total_trades": 0, "verdict": "discarded", "iteration": 32}
{"strategy_type": "rsi_oversold", "params": {"rsi_period": 14, "rsi_oversold": 30, "rsi_overbought": 70, "stoploss": -0.05, "timeframe": "1h", "_strategy_id": "efbfeb8e"}, "timerange": "20230712-20231229", "regime": "", "sentiment_score": 0.0, "sharpe": 0.48226890721218263, "win_rate": 0.8163265306122449, "max_drawdown": 0.0018300881418608413, "total_trades": 49, "profit_factor": 1.0, "walk_forward_passed": false, "monte_carlo_dd_95pct": 0.0, "synthetic_sanity_passed": false, "verdict": "discarded", "iteration": 1}
{"strategy_type": "bollinger_bands", "params": {"bb_period": 20, "bb_std": 2.0, "stoploss": -0.05, "timeframe": "1h", "_strategy_id": "a6d4037a"}, "timerange": "20230712-20231229", "regime": "", "sentiment_score": 0.0, "sharpe": -0.5731009358775454, "win_rate": 0.6935483870967742, "max_drawdown": 0.002857519386239237, "total_trades": 124, "profit_factor": 1.0, "walk_forward_passed": false, "monte_carlo_dd_95pct": 0.0, "synthetic_sanity_passed": false, "verdict": "discarded", "iteration": 2}
{"strategy_type": "combined_sma_rsi", "params": {"fast_ma": 5, "slow_ma": 20, "rsi_period": 7, "rsi_threshold": 50, "stoploss": -0.05, "timeframe": "1h", "_strategy_id": "1505774b"}, "timerange": "20230712-20231229", "regime": "", "sentiment_score": 0.0, "sharpe": -4.811784475600106, "win_rate": 0.3129496402877698, "max_drawdown": 0.0038862027399445215, "total_trades": 278, "profit_factor": 1.0, "walk_forward_passed": false, "monte_carlo_dd_95pct": 0.0, "synthetic_sanity_passed": false, "verdict": "discarded", "iteration": 3}
{"strategy_type": "rsi_oversold", "params": {"rsi_period": 14, "rsi_oversold": 30, "rsi_overbought": 70, "stoploss": -0.05, "timeframe": "1h", "_strategy_id": "efbfeb8e"}, "timerange": "20210313-20210830", "regime": "", "sentiment_score": 0.0, "sharpe": -1.579201828633213, "win_rate": 0.7821782178217822, "max_drawdown": 0.005389114040885988, "total_trades": 101, "profit_factor": 1.0, "walk_forward_passed": false, "monte_carlo_dd_95pct": 0.0, "synthetic_sanity_passed": false, "verdict": "discarded", "iteration": 4}
{"strategy_type": "rsi_oversold", "params": {"rsi_period": 14, "rsi_oversold": 30, "rsi_overbought": 70, "stoploss": -0.05, "timeframe": "1h", "_strategy_id": "efbfeb8e"}, "timerange": "20181113-20190502", "regime": "", "sentiment_score": 0.0, "sharpe": -1.0098775841510432, "win_rate": 0.7777777777777778, "max_drawdown": 0.004984740683000018, "total_trades": 72, "profit_factor": 1.0, "walk_forward_passed": false, "monte_carlo_dd_95pct": 0.0, "synthetic_sanity_passed": false, "verdict": "discarded", "iteration": 5}
{"strategy_type": "rsi_oversold", "params": {"rsi_period": 14, "rsi_oversold": 30, "rsi_overbought": 70, "stoploss": -0.03, "timeframe": "1h", "_strategy_id": "9127640a"}, "timerange": "20230712-20231229", "regime": "", "sentiment_score": 0.0, "sharpe": 0.10255704723838485, "win_rate": 0.7636363636363637, "max_drawdown": 0.0020459498871412273, "total_trades": 55, "profit_factor": 1.0, "walk_forward_passed": false, "monte_carlo_dd_95pct": 0.0, "synthetic_sanity_passed": false, "verdict": "discarded", "iteration": 6}
{"strategy_type": "rsi_oversold", "params": {"rsi_period": 14, "rsi_oversold": 30, "rsi_overbought": 70, "stoploss": -0.08, "timeframe": "1h", "_strategy_id": "49e25666"}, "timerange": "20230712-20231229", "regime": "", "sentiment_score": 0.0, "sharpe": 0.4899427992498922, "win_rate": 0.8541666666666666, "max_drawdown": 0.0019484793802934876, "total_trades": 48, "profit_factor": 1.0, "walk_forward_passed": false, "monte_carlo_dd_95pct": 0.0, "synthetic_sanity_passed": false, "verdict": "discarded", "iteration": 7}
{"strategy_type": "bollinger_bands", "params": {"bb_period": 20, "bb_std": 2.0, "stoploss": -0.03, "timeframe": "1h", "_strategy_id": "1159a53f"}, "timerange": "20230712-20231229", "regime": "", "sentiment_score": 0.0, "sharpe": -0.9664212866452397, "win_rate": 0.6893939393939394, "max_drawdown": 0.0020422338216387987, "total_trades": 132, "profit_factor": 1.0, "walk_forward_passed": false, "monte_carlo_dd_95pct": 0.0, "synthetic_sanity_passed": false, "verdict": "discarded", "iteration": 8}
{"strategy_type": "rsi_oversold", "params": {"rsi_period": 14, "rsi_oversold": 30, "rsi_overbought": 70, "stoploss": -0.05, "timeframe": "1h", "_strategy_id": "efbfeb8e"}, "timerange": "20230101-20231231", "regime": "", "sentiment_score": 0.0, "sharpe": 0.5928376794066332, "win_rate": 0.8376068376068376, "max_drawdown": 0.0018275464558902485, "total_trades": 117, "profit_factor": 1.0, "walk_forward_passed": false, "monte_carlo_dd_95pct": 0.0, "synthetic_sanity_passed": false, "verdict": "discarded", "iteration": 9}
{"strategy_type": "rsi_oversold", "params": {"rsi_period": 14, "rsi_oversold": 30, "rsi_overbought": 70, "stoploss": -0.05, "timeframe": "1h", "_strategy_id": "efbfeb8e"}, "timerange": "20220101-20221231", "regime": "", "sentiment_score": 0.0, "sharpe": -2.4383487633110894, "win_rate": 0.7317073170731707, "max_drawdown": 0.013743678567153373, "total_trades": 205, "profit_factor": 1.0, "walk_forward_passed": false, "monte_carlo_dd_95pct": 0.0, "synthetic_sanity_passed": false, "verdict": "discarded", "iteration": 10}
{"strategy_type": "sma_crossover", "params": {"fast_ma": 5, "slow_ma": 20, "stoploss": -0.05, "timeframe": "1h", "_strategy_id": "da74c7e3"}, "timerange": "20230101-20231231", "regime": "", "sentiment_score": 0.0, "sharpe": -2.938340205696547, "win_rate": 0.39593908629441626, "max_drawdown": 0.006457725871003862, "total_trades": 591, "profit_factor": 1.0, "walk_forward_passed": false, "monte_carlo_dd_95pct": 0.0, "synthetic_sanity_passed": false, "verdict": "discarded", "iteration": 11}
{"strategy_type": "rsi_oversold", "params": {"rsi_period": 14, "rsi_oversold": 30, "rsi_overbought": 70, "stoploss": -0.05, "timeframe": "1h", "_strategy_id": "efbfeb8e"}, "timerange": "20230101-20231231", "regime": "", "sentiment_score": 0.0, "sharpe": 0.28961896820063143, "win_rate": 0.8076923076923077, "max_drawdown": 0.0006491895863998276, "total_trades": 52, "profit_factor": 1.0, "walk_forward_passed": false, "monte_carlo_dd_95pct": 0.0, "synthetic_sanity_passed": false, "verdict": "discarded", "iteration": 12}
{"strategy_type": "rsi_oversold", "params": {"rsi_period": 14, "rsi_oversold": 30, "rsi_overbought": 70, "stoploss": -0.05, "timeframe": "1h", "_strategy_id": "efbfeb8e"}, "timerange": "20230101-20231231", "regime": "", "sentiment_score": 0.0, "sharpe": 0.306281450874, "win_rate": 0.8615384615384616, "max_drawdown": 0.0014143964590591688, "total_trades": 65, "profit_factor": 1.0, "walk_forward_passed": false, "monte_carlo_dd_95pct": 0.0, "synthetic_sanity_passed": false, "verdict": "discarded", "iteration": 13}
{"strategy_type": "rsi_oversold", "params": {"rsi_period": 14, "rsi_oversold": 30, "rsi_overbought": 70, "stoploss": -0.05, "timeframe": "1h", "_strategy_id": "efbfeb8e"}, "timerange": "20230701-20231231", "regime": "", "sentiment_score": 0.0, "sharpe": 0.6284906119842522, "win_rate": 0.8269230769230769, "max_drawdown": 0.0018295399866363694, "total_trades": 52, "profit_factor": 1.0, "walk_forward_passed": false, "monte_carlo_dd_95pct": 0.0, "synthetic_sanity_passed": false, "verdict": "discarded", "iteration": 14}
{"strategy_type": "rsi_oversold", "params": {"rsi_period": 14, "rsi_oversold": 30, "rsi_overbought": 70, "stoploss": -0.05, "timeframe": "1h", "_strategy_id": "efbfeb8e"}, "timerange": "20230801-20231231", "regime": "", "sentiment_score": 0.0, "sharpe": 0.21902111419493442, "win_rate": 0.813953488372093, "max_drawdown": 0.0018309359422234383, "total_trades": 43, "profit_factor": 1.0, "walk_forward_passed": false, "monte_carlo_dd_95pct": 0.0, "synthetic_sanity_passed": false, "verdict": "discarded", "iteration": 15}
{"strategy_type": "rsi_oversold", "params": {"stoploss": -0.05, "rsi_period": 14, "rsi_buy_threshold": 30, "rsi_sell_threshold": 70, "timeframe": "1h", "_strategy_id": "f4060b71"}, "timerange": "20230701-20231231", "regime": "", "sentiment_score": 0.0, "sharpe": 0.6284906119842522, "win_rate": 0.8269230769230769, "max_drawdown": 0.0018295399866363694, "total_trades": 52, "profit_factor": 1.0, "walk_forward_passed": false, "monte_carlo_dd_95pct": 0.0, "synthetic_sanity_passed": false, "verdict": "discarded", "iteration": 16}
{"strategy_type": "rsi_oversold", "params": {"stoploss": -0.05, "rsi_period": 14, "rsi_buy_threshold": 30, "rsi_sell_threshold": 70, "timeframe": "1h", "_strategy_id": "f4060b71"}, "timerange": "20230101-20231231", "regime": "", "sentiment_score": 0.0, "sharpe": 0.5928376794066332, "win_rate": 0.8376068376068376, "max_drawdown": 0.0018275464558902485, "total_trades": 117, "profit_factor": 1.0, "walk_forward_passed": false, "monte_carlo_dd_95pct": 0.0, "synthetic_sanity_passed": false, "verdict": "discarded", "iteration": 17}
{"strategy_type": "rsi_oversold", "params": {"stoploss": -0.05, "rsi_period": 14, "rsi_buy_threshold": 30, "rsi_sell_threshold": 70, "timeframe": "4h", "_strategy_id": "f4060b71"}, "timerange": "20230101-20231231", "regime": "", "sentiment_score": 0.0, "sharpe": 0.5928376794066332, "win_rate": 0.8376068376068376, "max_drawdown": 0.0018275464558902485, "total_trades": 117, "profit_factor": 1.0, "walk_forward_passed": false, "monte_carlo_dd_95pct": 0.0, "synthetic_sanity_passed": false, "verdict": "discarded", "iteration": 18}
{"strategy_type": "bollinger_bands", "params": {"bb_period": 20, "bb_std": 2.0, "stoploss": -0.05, "timeframe": "1h", "_strategy_id": "a6d4037a"}, "timerange": "20230701-20231231", "regime": "", "sentiment_score": 0.0, "sharpe": -0.43787123160538377, "win_rate": 0.6917293233082706, "max_drawdown": 0.002857264152563383, "total_trades": 133, "profit_factor": 1.0, "walk_forward_passed": false, "monte_carlo_dd_95pct": 0.0, "synthetic_sanity_passed": false, "verdict": "discarded", "iteration": 19}
{"strategy_type": "sentiment_driven", "params": {"rsi_period": 14, "rsi_oversold": 30, "rsi_overbought": 70, "stoploss": -0.05, "timeframe": "1h", "_strategy_id": "7243ebdf"}, "timerange": "20230701-20231231", "regime": "", "sentiment_score": 0.0, "sharpe": -0.23544038289411953, "win_rate": 0.0, "max_drawdown": 9.366638100000273e-05, "total_trades": 2, "profit_factor": 1.0, "walk_forward_passed": false, "monte_carlo_dd_95pct": 0.0, "synthetic_sanity_passed": false, "verdict": "discarded", "iteration": 20}
{"strategy_type": "bollinger_bands", "params": {"bb_period": 10, "bb_std": 2.0, "stoploss": -0.05, "timeframe": "1h", "_strategy_id": "a29c6370"}, "timerange": "20230701-20231231", "regime": "", "sentiment_score": 0.0, "sharpe": -0.43787123160538377, "win_rate": 0.6917293233082706, "max_drawdown": 0.002857264152563383, "total_trades": 133, "profit_factor": 1.0, "walk_forward_passed": false, "monte_carlo_dd_95pct": 0.0, "synthetic_sanity_passed": false, "verdict": "discarded", "iteration": 21}
{"strategy_type": "rsi_oversold", "params": {"stoploss": -0.05, "rsi_period": 14, "rsi_buy_threshold": 30, "rsi_sell_threshold": 70, "timeframe": "1h", "_strategy_id": "f4060b71"}, "timerange": "20230401-20230930", "regime": "", "sentiment_score": 0.0, "sharpe": 0.008032489917010412, "win_rate": 0.7966101694915254, "max_drawdown": 0.001255592273255552, "total_trades": 59, "profit_factor": 1.0, "walk_forward_passed": false, "monte_carlo_dd_95pct": 0.0, "synthetic_sanity_passed": false, "verdict": "discarded", "iteration": 22}
{"strategy_type": "rsi_oversold", "params": {"stoploss": -0.05, "rsi_period": 14, "rsi_buy_threshold": 30, "rsi_sell_threshold": 70, "timeframe": "1h", "_strategy_id": "f4060b71"}, "timerange": "20230701-20230930", "regime": "", "sentiment_score": 0.0, "sharpe": 0.04746330559162728, "win_rate": 0.7916666666666666, "max_drawdown": 0.0012400564345222023, "total_trades": 24, "profit_factor": 1.0, "walk_forward_passed": false, "monte_carlo_dd_95pct": 0.0, "synthetic_sanity_passed": false, "verdict": "discarded", "iteration": 23}
{"strategy_type": "rsi_oversold", "params": {"stoploss": -0.05, "rsi_period": 14, "rsi_buy_threshold": 30, "rsi_sell_threshold": 70, "timeframe": "1h", "_strategy_id": "f4060b71"}, "timerange": "20231001-20231231", "regime": "", "sentiment_score": 0.0, "sharpe": 1.335728099993389, "win_rate": 0.8571428571428571, "max_drawdown": 0.0008138982480000777, "total_trades": 28, "profit_factor": 1.0, "walk_forward_passed": false, "monte_carlo_dd_95pct": 0.0, "synthetic_sanity_passed": false, "verdict": "kept", "iteration": 24}
{"strategy_type": "multi_timeframe", "params": {"stoploss": -0.05, "timeframe": "1h", "_strategy_id": "1041b8b5"}, "timerange": "20230101-20231231", "regime": "", "sentiment_score": 0.0, "sharpe": -0.5533365159297045, "win_rate": 0.4791666666666667, "max_drawdown": 0.002196556087858144, "total_trades": 48, "profit_factor": 1.0, "walk_forward_passed": false, "monte_carlo_dd_95pct": 0.0, "synthetic_sanity_passed": false, "verdict": "discarded", "iteration": 25}
{"strategy_type": "breakout", "params": {"stoploss": -0.05, "timeframe": "1h", "_strategy_id": "9bc28c5c"}, "timerange": "20230101-20231231", "regime": "", "sentiment_score": 0.0, "sharpe": -3.422895941425275, "win_rate": 0.4733606557377049, "max_drawdown": 0.009563960093076812, "total_trades": 488, "profit_factor": 1.0, "walk_forward_passed": false, "monte_carlo_dd_95pct": 0.0, "synthetic_sanity_passed": false, "verdict": "discarded", "iteration": 26}
{"strategy_type": "rsi_oversold", "params": {"stoploss": -0.05, "rsi_period": 14, "rsi_buy_threshold": 30, "rsi_sell_threshold": 70, "timeframe": "1h", "_strategy_id": "f4060b71"}, "timerange": "20231001-20231231", "regime": "", "sentiment_score": 0.0, "sharpe": 1.335728099993389, "win_rate": 0.8571428571428571, "max_drawdown": 0.0008138982480000777, "total_trades": 28, "profit_factor": 1.0, "walk_forward_passed": false, "monte_carlo_dd_95pct": 0.0, "synthetic_sanity_passed": false, "verdict": "kept", "iteration": 27}
{"strategy_type": "rsi_oversold", "params": {"stoploss": -0.05, "rsi_period": 14, "rsi_buy_threshold": 30, "rsi_sell_threshold": 70, "timeframe": "1h", "_strategy_id": "f4060b71"}, "timerange": "20230101-20231231", "regime": "", "sentiment_score": 0.0, "sharpe": 0.5928376794066332, "win_rate": 0.8376068376068376, "max_drawdown": 0.0018275464558902485, "total_trades": 117, "profit_factor": 1.0, "walk_forward_passed": false, "monte_carlo_dd_95pct": 0.0, "synthetic_sanity_passed": false, "verdict": "discarded", "iteration": 28}
{"strategy_type": "rsi_oversold", "params": {"rsi_period": 7, "rsi_oversold": 25, "rsi_overbought": 75, "stoploss": -0.05, "timeframe": "1h", "_strategy_id": "17a0793f"}, "timerange": "20230101-20231231", "regime": "", "sentiment_score": 0.0, "sharpe": 0.5928376794066332, "win_rate": 0.8376068376068376, "max_drawdown": 0.0018275464558902485, "total_trades": 117, "profit_factor": 1.0, "walk_forward_passed": false, "monte_carlo_dd_95pct": 0.0, "synthetic_sanity_passed": false, "verdict": "discarded", "iteration": 29}
{"strategy_type": "bollinger_bands", "params": {"bb_period": 20, "bb_std": 2.0, "stoploss": -0.05, "timeframe": "1h", "_strategy_id": "a6d4037a"}, "timerange": "20231001-20231231", "regime": "", "sentiment_score": 0.0, "sharpe": 0.4513031821652467, "win_rate": 0.6774193548387096, "max_drawdown": 0.0011488173026344252, "total_trades": 62, "profit_factor": 1.0, "walk_forward_passed": false, "monte_carlo_dd_95pct": 0.0, "synthetic_sanity_passed": false, "verdict": "discarded", "iteration": 30}
{"strategy_type": "bollinger_bands", "params": {"bb_period": 20, "bb_std": 2.0, "stoploss": -0.05, "timeframe": "1h", "_strategy_id": "63b275e3"}, "timerange": "20231001-20231231", "regime": "", "sentiment_score": 0.0, "sharpe": 0.4513031821652467, "win_rate": 0.6774193548387096, "max_drawdown": 0.0011488173026344252, "total_trades": 62, "profit_factor": 1.0, "walk_forward_passed": false, "monte_carlo_dd_95pct": 0.0, "synthetic_sanity_passed": false, "verdict": "discarded", "iteration": 31}
{"strategy_type": "rsi_oversold", "params": {"rsi_period": 14, "rsi_oversold": 30, "rsi_overbought": 70, "stoploss": -0.05, "timeframe": "1h", "_strategy_id": "33fcb635"}, "timerange": "20231001-20231231", "regime": "", "sentiment_score": 0.0, "sharpe": 1.335728099993389, "win_rate": 0.8571428571428571, "max_drawdown": 0.0008138982480000777, "total_trades": 28, "profit_factor": 1.0, "walk_forward_passed": false, "monte_carlo_dd_95pct": 0.0, "synthetic_sanity_passed": false, "verdict": "kept", "iteration": 32}
{"strategy_type": "combined_sma_rsi", "params": {"fast_ma": 10, "slow_ma": 30, "rsi_period": 14, "rsi_threshold": 50, "stoploss": -0.05, "timeframe": "1h", "_strategy_id": "97859bad"}, "timerange": "20231001-20231231", "regime": "", "sentiment_score": 0.0, "sharpe": 0.5693780031575675, "win_rate": 0.5662650602409639, "max_drawdown": 0.001209948652139587, "total_trades": 83, "profit_factor": 1.0, "walk_forward_passed": false, "monte_carlo_dd_95pct": 0.0, "synthetic_sanity_passed": false, "verdict": "discarded", "iteration": 33}
{"strategy_type": "rsi_oversold", "params": {"rsi_period": 7, "rsi_oversold": 25, "rsi_overbought": 75, "stoploss": -0.05, "timeframe": "1h", "_strategy_id": "bf5005ca"}, "timerange": "20231001-20231231", "regime": "", "sentiment_score": 0.0, "sharpe": 1.335728099993389, "win_rate": 0.8571428571428571, "max_drawdown": 0.0008138982480000777, "total_trades": 28, "profit_factor": 1.0, "walk_forward_passed": false, "monte_carlo_dd_95pct": 0.0, "synthetic_sanity_passed": false, "verdict": "kept", "iteration": 34}
{"strategy_type": "macd_crossover", "params": {"macd_fast": 12, "macd_slow": 26, "macd_signal": 9, "stoploss": -0.05, "timeframe": "1h", "_strategy_id": "42e65814"}, "timerange": "20231001-20231231", "regime": "", "sentiment_score": 0.0, "sharpe": -6.269517729595427, "win_rate": 0.3764705882352941, "max_drawdown": 0.0032180668297487423, "total_trades": 170, "profit_factor": 1.0, "walk_forward_passed": false, "monte_carlo_dd_95pct": 0.0, "synthetic_sanity_passed": false, "verdict": "discarded", "iteration": 35}
{"strategy_type": "rsi_oversold", "params": {"rsi_period": 5, "rsi_oversold": 25, "rsi_overbought": 75, "stoploss": -0.05, "timeframe": "1h", "_strategy_id": "cd4ba679"}, "timerange": "20231001-20231231", "regime": "", "sentiment_score": 0.0, "sharpe": 1.335728099993389, "win_rate": 0.8571428571428571, "max_drawdown": 0.0008138982480000777, "total_trades": 28, "profit_factor": 1.0, "walk_forward_passed": false, "monte_carlo_dd_95pct": 0.0, "synthetic_sanity_passed": false, "verdict": "kept", "iteration": 36}
{"strategy_type": "bollinger_bands", "params": {"bb_period": 20, "bb_std": 1.5, "stoploss": -0.05, "timeframe": "1h", "_strategy_id": "bf867723"}, "timerange": "20231001-20231231", "regime": "", "sentiment_score": 0.0, "sharpe": 0.4513031821652467, "win_rate": 0.6774193548387096, "max_drawdown": 0.0011488173026344252, "total_trades": 62, "profit_factor": 1.0, "walk_forward_passed": false, "monte_carlo_dd_95pct": 0.0, "synthetic_sanity_passed": false, "verdict": "discarded", "iteration": 37}
{"strategy_type": "combined_sma_rsi", "params": {"fast_ma": 5, "slow_ma": 15, "rsi_period": 7, "rsi_threshold": 40, "stoploss": -0.05, "timeframe": "1h", "_strategy_id": "8bd400cd"}, "timerange": "20231001-20231231", "regime": "", "sentiment_score": 0.0, "sharpe": -8.377586335135772, "win_rate": 0.3333333333333333, "max_drawdown": 0.003684086765000029, "total_trades": 186, "profit_factor": 1.0, "walk_forward_passed": false, "monte_carlo_dd_95pct": 0.0, "synthetic_sanity_passed": false, "verdict": "discarded", "iteration": 38}
